title,vote_average,vote_count,revenue,keywords
Conan O'Brien Can't Stop,6.517,120,223959,"comedian, behind the scenes, singing, loss of job, duringcreditsstinger"
Eating Out: The Open Weekend,5.7,67,0,"vacation, promiscuity, palm springs, resort, lgbt, sex comedy, foursome, hookup, gay theme, gay relationship"
Spy Kids: All the Time in the World,4.699,1039,85564310,"espionage, spy, child hero, secret agent"
King George VI: The Man Behind the King's Speech,7.9,7,0,"stutter, speech, king, speech impediment, stutterer, king of england, british royal family"
"Alone, 180 Days on Baikal Lake",8.0,1,0,"experiment, isolation, winter, nature documentary"
Munger Road,4.324,34,0,"escaped convict, ghost hunting, festival, found footage, autumn"
Dragons: Gift of the Night Fury,7.188,408,0,"holiday, human animal relationship, vikings (norsemen), best friend, dragon, teenage hero, christmas, father son relationship, christmas special, dragon egg"
Hoodwinked Too! Hood VS. Evil,5.1,563,13500000,"witch, wolf, little red riding hood, sequel, goat, aftercreditsstinger, duringcreditsstinger"
Les Enfoirés 2011 - Dans l'oeil des Enfoirés,5.8,10,0,"musical, singer, benefit concert, farewell concert, french music, tribute concert, music show, musical adaptation"
Field of Dreams 2: Lockout,5.7,3,0,short film
"A Fairly Odd Movie: Grow Up, Timmy Turner!",4.845,233,0,live action and animation
Super Shark,4.1,66,0,"marine biologist, shark attack, los angeles, california, shark"
The Day I Saw Your Heart,5.839,109,0,woman director
TRON: The Next Day,5.681,94,0,"revolutionary, short film"
Dracula: The Vampire and the Voivode,10.0,1,0,"transylvania, folklore"
The Heart of Christmas,6.2,19,0,"leukemia, cancer, illness, sick child, childhood cancer"
Street Kings 2: Motor City,4.3,92,0,"corruption, detective, investigation, sequel, murder, betrayal, killer, detroit, michigan"
MTV Unplugged: Los Tigres del Norte and Friends,5.7,5,0,concert
"Big Mommas: Like Father, Like Son",5.6,1280,82686066,"undercover, fbi, sequel, disguise, impersonation, duringcreditsstinger"
Warrior,7.8,4843,23300000,"bank, training, beating, mixed martial arts (mma), teacher, muscleman, combat, alcoholic, gym, exercise, pittsburgh, pennsylvania, intense, complicated, familiar"
When a City Falls,0.5,2,0,disaster
The Darkest Hour,5.303,1542,64626786,"alien invasion, american abroad, moscow, russia, failed business, microwave, faraday"
A Morte de Carlos Gardel,6.5,2,0,"woman director, carlos gardel"
God Bless Ozzy Osbourne,7.857,42,0,"concert, live, music documentary"
Alvin and the Chipmunks: Chipwrecked,5.696,2292,342695435,"sequel, chipmunk, cruise ship, live action and animation, overboard"
Mean Girls 2,5.246,1273,0,"woman director, high school rivalry"
The River Murders,5.2,125,0,crime suspense
The Black Power Mixtape 1967-1975,7.583,42,268813,"political activism, black panther party, black activist, political activist, black power, cointel pro, black liberation"
I'd Receive the Worst News from Your Beautiful Lips,5.781,16,0,love
Barbie: A Fairy Secret,6.9,527,0,"magic, fairy, based on toy, female protagonist, magic land, 3d animation"
The Last Post,0.0,0,0,short film
U2: From the Sky Down,7.4,21,0,"rock 'n' roll, post-punk, alternative rock"
Royal Opera House: Tosca,9.0,2,0,"opera, live, opera live performance"
Doraemon: Nobita and the New Steel Troops: Winged Angels,7.346,81,0,"based on comic, remake, robot, anime"
Comedy Central Roast of Charlie Sheen,7.2,94,0,"comedian, insult, roast"
One Day,7.4,4435,59400000,"based on novel or book, comedian, love, author, writer, divorce, friends in love, woman director, missed opportunity"
Dreams of a Life,6.5,69,6595,"skeleton, london, england, isolation, dead woman, woman director, mysterious death, 2000s, black woman"
Daydream Nation,5.76,169,0,"high school, serial killer, stoner"
"Louis XVI, l'homme qui ne voulait pas être roi",8.5,2,0,"revolution, versailles"
Alpine Meltdown: Just a few degrees more...,0.0,0,0,"climate, klima"
The Green Hornet,5.594,3382,227817248,"martial arts, assassin, bomb, superhero, nightclub, vandalism, training, knife, trap, playboy, revenge, kato, meth lab"
A Monster in Paris,6.9,1315,26611650,"monster, paris, france, romantic"
War of the Buttons,6.0,471,15000000,"based on novel or book, remake, button, war context, 1940s, occupied france (1940-44), children in wartime"
Stone Cold Steve Austin: The Bottom Line on the Most Popular Superstar of All Time,8.4,17,0,"sports, biography, sports documentary, documentary"
Princess and the Pony,4.7,9,0,woman director
All She Can,4.8,11,0,woman director
Quest for Zhu,5.029,17,0,pet
Joanna Makes a Friend,0.0,0,0,short film
The Adventures of Tintin,6.915,5637,373993951,"treasure, riddle, morocco, belgium, treasure hunt, liquor, based on comic, sunken treasure, reporter, belgian, 1950s, excited"
Ikaw ang Pag-ibig,0.0,0,0,"philippines, religion, woman director"
Ivan's Woman,3.5,2,0,"pedophilia, hostage"
Charge,0.0,0,0,"motor sport, motorcycle, green energy, isle of man"
The Source,6.6,187,0,"husband wife relationship, village life, female protagonist"
War of the Arrows,7.2,274,49000000,"archer, arrow, bow and arrow, archery, 17th century, joseon dynasty (1392–1910), chinese invasion of korea"
Contagion,6.645,6343,137551594,"quarantine, saving the world, mutation, infection, terminal illness, outbreak, disease, vaccine, lethal virus, scientist, epidemic, prophetic, virus, pandemic, medical drama"
Apollo 18,5.31,1058,25562924,"moon, nasa, infection, moon landing, alien, astronaut, alien infection, found footage, aliens, pseudo-documentary"
Twiggy,5.6,21,0,"marseille, france, woman director"
Hugo,7.173,7488,185770160,"paris, france, based on novel or book, library, clock tower, key, clock, museum, montparnasse, steampunk, orphan, robot, filmmaking, security guard, leg brace, doberman, runaway train, railway station, guard dog, toy maker, mechanical toys, toymaker, lyrical, ticking clock, based on young adult novel, clockwork, train station, toy, stationmaster, clockmaker, mechanical dolls"
The Legend of La Llorona,7.735,283,3900000,"based on myths, legends or folklore"
Kylie Minogue: Aphrodite Les Folies - Live in London,8.2,14,0,concert
Hop,5.795,1351,183953723,"bunny, coup d'etat, villain, slacker, easter, easter bunny, rabbit, aftercreditsstinger, live action and animation, illumination, chick"
Chrysalis,6.9,19,226287,woman director
Tom and Jerry & The Wizard of Oz,6.3,128,0,based on young adult novel
The Voyages of Young Doctor Dolittle,0.0,0,0,anthropomorphism
Going Down in La-La Land,5.706,51,0,"based on novel or book, celebrity, fame, male prostitution, hollywood, los angeles, california, porn industry, group of friends, aspiring actor, gay pornography, closeted homosexual, gay theme, night swimming"
A Dangerous Method,6.354,2156,27462041,"infidelity, based on novel or book, psychoanalysis, sigmund freud, biography, based on true story, cigar smoking, spanking, patient, carl jung"
The Resident,5.776,660,0,"new york city, obsession, old man, stalking, landlord, hospital, doctor, brooklyn, new york city, emergency doctor, living alone, marital separation, moving in, old building, runner, handyman, creepy, in the dark, cheating husband, secrets, behind the wall, violation, unnerving"
Christmas Comes Home to Canaan,5.4,26,0,christmas
Beirut Hotel,4.75,10,0,woman director
Fists of Pride,0.0,0,0,"thailand, burma, poverty, woman director"
Jack and Jill,4.388,2174,149700000,"thanksgiving, los angeles, california, family, celebration, duringcreditsstinger"
The Year Dolly Parton Was My Mom,6.6,13,0,"1970s, adoption, coming of age, little girl, running away"
3 Champions,7.7,3,0,"car race, sports, world champion, racing, formula one (f1)"
My Piece of the Pie,5.683,189,0,"france, kidnapping, bankrupt, protest, maid, unemployment, finance trading"
Return,6.437,3917,8801,woman director
The Heineken Kidnapping,6.0,66,0,"kidnapping, beer"
The New Life,5.0,5,0,argentina
The Art of Flight,7.804,158,0,"sports, snowboard"
TT3D: Closer to the Edge,7.5,124,0,"sports, motor sport, street race, motorcycle"
Friends After 3.11,7.0,2,0,"disaster, nuclear, tohoku, fukushima disaster (2011), nuclear disaster, great east japan earthquake, disaster aftermath"
"Marcel the Shell with Shoes On, Two",6.906,32,0,"stop motion, short film"
Into the Lion's Den,3.7,13,0,"countryside, psychopath, blind date, friends, torture, trapped, lgbt, depravity, gay theme"
Stake Land: The Day I Told My Boyfriend,0.0,0,0,"car accident, short film"
History of the World in Two Hours,6.1,38,0,"natural history, science history"
Brendan Smyth:  Betrayal of Trust,4.0,1,0,"based on true story, northern ireland, pedophile priest, investigative journalist"
The British Guide to Showing Off,6.6,8,0,"london, england, beauty contest, beauty queen contest, alternative"
Lady Gaga Presents: The Monster Ball Tour at Madison Square Garden,8.6,106,0,"dance, concert, pop, singer, live performance, singer-songwriter, actress"
The Journey – Stories from the 2010 FIFA World Cup South Africa,0.0,0,0,"sports, world cup, football (soccer)"
Stilte na de storm,0.0,0,0,phone call
"François Mitterrand, à bout portant : 1993-1996",9.0,1,0,"dying and death, france, politics, dying man, death, portrait, archive footage, troubled past, 1990s, metaphysical"
Foo Fighters: A Hard Day's Light,0.0,0,0,"concert, live performance"
The End of an Era,0.0,0,0,"post-apocalyptic future, human extinction"
I Screamed When I Knew What You Did in Friday the 13th of Last Summer Part 2 - I Saw the Hour of the Return of the Revenge in Halloween,6.9,19,0,"murder, decapitation, massacre, doctor patient relationship, slasher spoof, horror parody"
Return to Jurassic Park,6.6,841,0,"behind the scenes, special effects, dinosaur, practical special effects"
The Snows of Kilimanjaro,6.7,130,4909485,"solidarity, marseille, france"
The Snitch Cartel,7.1,74,0,"organized crime, drug cartel, telenovela"
Hellraiser: Revelations,3.572,348,0,"pinhead, demon, puzzle box, cenobite"
Hostel: Part III,5.1,1259,0,"sadism, sequel, torture, las vegas, torture porn, ambivalent"
The Smurfs,5.759,3918,563749323,"moon, magic, based on comic, blue, vortex, cat and mouse, duringcreditsstinger, live action and animation"
The Universal Language,6.0,1,0,"language barrier, language, language and communication, native language, international communication, language history"
Killer Elite,6.263,2237,57777106,"rescue, assassin, mexico, based on novel or book, hostage, mentor, secret society, secret agent, beating, revenge, explosion, desert, death, military, 1980s"
House of Pleasures,6.5,274,0,"paris, france, brothel, eroticism, sexual fantasy, sexual humiliation, prostitution, sexual desire, sexual favor, sexual exploration, sexual experimentation, sexual relationship, sexual attitudes, sexual discovery, sexual education"
Immortals,6.037,2724,226904017,"army, poison, mythology, zeus, sword fight, minotaur, poseidon, spear, bow and arrow, labyrinth, ancient greece, greek god, fantasy, 13th century bc"
Perfect Sense,6.865,1208,138868,"glasgow, scotland, street riots, co-workers relationship, chef, boyfriend girlfriend relationship, pandemic, human nature, epidemiologist, five senses"
Source Code,7.303,8791,147332697,"race against time, bomb, virtual reality, identity, investigation, bomber, suspicion, surrealism, time loop, soldier, helicopter pilot, augmented reality, action"
Waitangi Day: What Really Happened,0.0,0,0,"new zealand, maori, colonisation, waitangi"
Today Has Been Weird,0.0,0,0,"smoking, webcam, vancouver, vlogger"
Children of the Corn: Genesis,4.07,158,0,"cult, telekinesis, evil preacher, pregnant woman, corn, pathetic, ambiguous, baffled, earnest"
S.W.A.T.: Firefight,5.693,387,0,"detroit, michigan"
Wisdom of Changes - Richard Wilhelm and the I Ching,10.0,1,0,"china, missionary, biography, theologian, richard wilhelm"
Trespass,5.517,1180,9612469,"robbery, husband wife relationship, cocaine, knife, betrayal, home invasion, masked man, hostage situation"
Spots Spots,0.0,0,0,short film
Scream 4,6.474,3983,97231420,"rescue, mask, sheriff, jealousy, dark comedy, victim, knife, self-inflicted injury, sequel, sociopath, murder, house party, teen movie, serial killer, author, hospital, slasher, home invasion, self-referential, cousin relationship, phone call, satirical, millennials, publicist, fame-seeking, new generation, return to hometown, masked killer, absurd, remakes, amused"
The Woman in the Fifth,5.2,116,112498,"waitress, paris, france, widow, poetry, letter, writer, theft, divorce, monitor, translator, dependency, stuffed toy, ex-husband ex-wife relationship"
Twin Brothers: 53 Scenes in Chronological Order,4.1,7,0,"twin brother, twins, dwarfism"
Dragon Ball: Episode of Bardock,7.02,426,0,"time travel, based on manga, based on video game, anime, tv special, alternate ending"
Jake and the Never Land Pirates: Cubby's Goldfish,0.0,0,0,short film
The Devil's Double,6.698,582,5728213,"palace, impostor, pervertion"
Batman: Year One,7.241,1019,0,"superhero, based on comic, vigilante, police corruption, based on graphic novel, origin of hero, masked vigilante, adult animation, police vigilantism, woman director, vigilantism"
The Merry Wives of Windsor,5.7,3,0,"based on play or musical, live performance"
"A Day of One Hero, Starring Kazuki Shimizu",0.0,0,0,mockumentary
K-On! The Movie,7.9,102,21434003,"high school, london, england, england, slice of life, travel, singing, based on manga, rock band, schoolgirl, girl band, woman director, anime, japanese high school, high school girl, iyashikei, band"
Playing with Death,7.5,4,0,"black humor, grandfather, old man, death, nursing home, father son relationship, short film"
Egypt's Lost Cities,7.3,3,0,"egypt, lost civilisation, ancient egypt, ancient civilization"
Super 8,6.771,6877,260100000,"1970s, alien, train crash, firecracker, super 8mm footage, duringcreditsstinger, complex, suspenseful, intense, amused, familiar"
Winx Club - The Fate of Bloom,8.5,12,0,"cartoon, winx club"
The Hidden Face,7.295,1094,0,"orchestra, girlfriend, disappearance, voyeurism, orchestra conductor, secret room"
The Prey,6.449,217,0,"prison, prison escape, serial killer, police officer, handgun"
Stake Land: Willie,0.0,0,0,"lynching, short film"
The Eagle,6.247,1378,27122040,"roman empire, scotland, slavery, eagle, ancient rome, honor, disappearance, ancient world, britain, slave, scottish highlands, 2nd century, hadrian’s wall"
Blitz,6.182,1735,15800000,"london, england, based on novel or book, homophobia, psychopath, revenge, murder, arson, serial killer, lawyer, police detective, lgbt, mean spirited"
Paparazzi Eye in the Dark,0.0,0,0,"paparazzi, success, man of one's dreams, money, survival, murder"
The Ten Commandments: Making Miracles,9.2,4,0,"ten commandments, making of"
Fullmetal Alchemist: The Sacred Star of Milos,6.8,280,7621364,"travel, fugitive, conspiracy, based on manga, alchemy, adult animation, alchemist, shounen, anime, adventure"
Colors in the Dark,5.409,11,1692948,woman director
Runnin' Rebels of UNLV,6.7,6,0,"las vegas, basketball team, unlv"
Laurel & Hardy: Their Lives and Magic,7.722,18,0,"england, movie business, slapstick comedy, silent film, music hall"
"Los muertos no se tocan, nene",4.8,11,0,"family relationships, black and white, spanish literature, spanish"
Pathfinders: In the Company of Strangers,4.2,33,0,"normandy, france, paratrooper"
Assassination Games,6.3,438,0,"fight, anti hero, karate, drug cartel, sharpshooter, knife throwing, silencer, knife fight, gist fight, kickboxing"
Eames: The Architect and the Painter,7.1,35,0,"biography, architecture, art"
Beats Rhymes & Life: The Travels of A Tribe Called Quest,7.145,55,0,"rap music, hip-hop, duringcreditsstinger"
Margin Call,6.864,1982,19504039,"capitalism, brokerage, wall street, based on true story, morality, economics, downsizing, financial crisis, stock market, stock market crash, investment, investment banker"
The Flowers of War,7.415,859,95311434,"rape, based on novel or book, brothel, based on true story, atrocity, prostitution, forced prostitution, nanking massacre china 1937, japanese occupation of china"
The Adjustment Bureau,6.769,4757,127900000,"hotel, future, plan, dancer, hat, marriage, senator, kiss, politician, honesty, alone, speech, fate, foot chase, covert agency, courthouse, political campaign, destiny, time freeze , based on short story"
Albert Nobbs,6.345,497,5634828,"butler, dublin, ireland, maid"
Room 304,6.4,8,0,"hotel room, copenhagen, denmark, woman director"
Nuclear Savage: The Islands of Secret Project 4.1,6.4,6,0,"propaganda, politics, war crimes, cold war, hydrogen bomb, nuclear radiation, double moral standard, leukemia, cancer, atrocity, racism, genocide, guinea pig, destiny, forced relocation, militarism, medical research, nuclear fallout, responsibility, south pacific, birth defect, environmental destruction, secret project, shocking, classified, objectification"
Lessons of a Dream,6.9,118,1373312,"sports, amateur football (soccer), school, football (soccer), teaching, school life, 19th century"
More Business of Being Born,0.0,0,0,"birth, mothering, home birth, woman director"
Attenborough and the Giant Egg,8.6,4,0,"madagascar, fossil, woman director, nature documentary, extinct"
Scooby-Doo! Legend of the Phantosaur,7.774,215,0,"talking dog, dinosaur"
Top Cat: The Movie,6.1,83,16611575,based on cartoon
Machine Gun Preacher,6.723,1100,2527904,duringcreditsstinger
Poltergays: The Naked Wolves of the SS,6.0,2,0,"nazi officer, horror spoof, nazisploitation (nazi exploitation film), nazism, nazi occultism"
When Santa Fell to Earth,5.1,21,0,christmas
Battle: Los Angeles,5.81,3618,211800000,"hero, saving the world, chaos, marine corps, retirement, meteor, space invasion, alien, survival, battlefield, sergeant, los angeles, california, battle, alien invasion, u.s. marine, escapade, heroic mission, evil alien"
Finding a Family,6.5,15,0,"adoption, graduation, foster care, manic depression"
Horrible Bosses,6.572,6620,209838559,"bad boss, employee, death of father, stakeout, duringcreditsstinger, derogatory"
Coriolanus,5.843,475,1072602,"senate, general, market, rivalry, tragedy, tears, scar, stabbing, truce, flag"
All the Time in the World,5.969,16,676045,"sibling relationship, love triangle, breast cancer, family, lgbt, older brother younger sister, duringcreditsstinger"
Pokémon the Movie: Black - Victini and Reshiram,6.6,174,28550000,"battle, anime"
Guilty of Romance,6.9,234,246091,"prostitution, novelist, police investigation, pink film, husband wife estrangement, nude modeling, love hotel, romantic thriller, tokyo"
The Tuche Family,5.998,1336,13867701,"lottery, monaco"
1911,5.7,159,3807134,"martial arts, sword, revolution, gunfight, brutality, combat"
Once in a Blue Moon,7.2,40,0,"japan, court, trial, courthouse, courtroom, ghost, old ghost"
The Cinema and its Double: Rainer Werner Fassbinder's 'Despair' Revisited,6.5,4,0,germany
Detective Conan: Quarter of Silence,7.097,145,42808575,"bomb, detective, revenge, murder, memory loss, car accident, anime, suspense"
The Salt of Life,6.0,52,2850852,maturity
The Scientology Handbook: Tools for Life,0.0,0,0,scientology
Shut Up Little Man! An Audio Misadventure,5.167,27,0,"homophobia, neighbor, noisy neighbor, audio recording, tape recording  "
Project Nim,6.839,140,0,"love of animals, wild animal, chimpanzee, linguistics"
Kill the Irishman,6.774,674,1188194,"assassination, irish-american, biography, mafia, car explosion, garbage truck, longshoreman"
Ronald Reagan: An American Journey,0.0,0,0,"usa president, ronald reagan, usa history"
I Could've Been a Hooker,4.5,4,0,"paris, france, man woman relationship, stalker, faint, love, stalking, love interest, older man younger woman relationship, female stalker, stranger, cutter, fainting, unlikely lovers, testicles, mysterious stranger, clippers, dizziness, accidental love, helping, hedge shears, abused child, short film, child sexual abuse, helpfulness, helper, women, strangers to lovers"
De sterkste man van Nederland,5.4,7,0,"single parent, sperm donor, father figure"
Blue Crush 2,5.8,119,0,"surfing, surfer, ocean, south africa, sequel"
Rajanna,4.333,3,0,tragedy
No One Killed Jessica,6.781,81,634297,candlelight vigil
Shaolin,6.859,390,33662874,"martial arts, kung fu, china, monk, warlord, parkour, mixed martial arts (mma), tai chi, duel, martial arts master, shaolin master, shaolin kung fu, martial artist, shaolin monk, fictional war, wu shu"
The Trouble with Bliss,4.9,58,11933,coming of age
Matthew Bourne's Christmas,10.0,2,0,"dancing, dance, choreography, christmas"
"Fast Freddie, the Widow and Me",5.5,4,0,"social work, terminal illness, community service, foster family"
Texas Killing Fields,5.8,505,957240,"torture, series of murders, multiple murder, woman director"
The Son of No One,5.09,321,618425,9/11
Lindsey Buckingham: Songs from the Small Machine (Live in L.A.),6.2,3,0,"concert, live"
Portable Life,0.0,0,0,"amulet, travel, fragmented"
Goodbye First Love,6.219,146,0,"beach, strike, paris, france, letter, architecture, teenage love, first love, woman director, teenage romance, teenager"
More Than You Can Chew,5.5,2,0,"vampire, short film, horror"
Never Back Down 2: The Beatdown,6.5,674,0,"sports, kiss, fistfight, cage, cage fighting, kickboxer, martial arts tournament, beefcake, martial arts training"
The Day: Remembering Dale Earnhardt,10.0,2,0,"racing, nascar, intimidator, earnhardt"
Return Ticket,7.0,14,0,woman director
A Tribute to Ryan Dunn,8.4,8,0,tribute
Sherlock Holmes: A Game of Shadows,7.141,10699,334615000,"london, england, paris, france, detective inspector, steampunk, buddy, criminal mastermind, 19th century, sherlock holmes"
Documentary of AKB48 The Future 1mm Ahead,0.0,0,0,"idol group, idol documentary"
Superman Now,10.0,2,0,"comic book, animated scene, based on graphic novel, making of, short film"
Age of the Dragons,4.1,107,0,"hero, based on novel or book, obsession, harpoon, rivalry, revenge, dragon, hunting, escapade, deadly, unfulfillment, dangerous animal, obsessive quest"
The Three Disappearances of Soad Hosni,6.0,1,0,woman director
Red Riding Hood,5.982,3255,89162162,"winter, fairy tale, little red riding hood, hood, werewolf, aftercreditsstinger, duringcreditsstinger, woman director, tense, romantic, melodramatic"
The Giants,7.0,43,0,"drug dealer, friendship, male friendship, coming of age, summer, teenage boy, boys, bad parenting"
The Hunt for Tony Blair,7.8,4,0,"film noir, 1950s, tony blair"
There's Something Wrong with Aunt Diane,6.631,99,0,"car crash, dui, driving under the influence"
Red Nights,4.167,12,0,"emperor, jade, murder, hong kong, torture, box"
Always,7.842,301,6941450,"attraction, blindness, dramatic"
Honey 2,6.269,405,0,"dance, competition, sequel, bronx, new york city, dance crew"
A Little Bit of Heaven,6.4,574,1296937,"workplace, cancer, co-workers relationship, dog allergy, doctor patient relationship, duringcreditsstinger, woman director"
My Way,7.9,425,16653488,"world war ii, japanese occupation of korea"
What Happens Next,4.7,27,0,"lgbt, gay theme"
388 Arletta Avenue,5.038,53,0,"stalker, found footage"
A Child's Garden of Poetry,4.0,1,0,"poetry, garden"
Ostia: The Last Night,2.667,3,0,"murder, gay theme"
All Superheroes Must Die,4.4,40,0,"superhero, death game"
Almost Perfect,2.0,1,0,woman director
Flying Swords of Dragon Gate,6.221,228,127709,"martial arts, sandstorm, eunuch, concubine, chinese emperor, wuxia, 15th century"
Ticket Out,5.6,37,0,"robbery, insulin, abusive father, domestic abuse, undercover cop, divorce, pharmacy, child custody, abusive husband, custody hearing, mother son relationship, mother daughter relationship, diabetes, child sexual abuse, nightmares"
Stalin's Last Plot,8.0,3,0,"paranoia, jew persecution, soviet union, joseph stalin, antisemitism, conspiracy, doctor, false accusations, archive footage, post world war ii, communism, denunciation, 1950s"
Shame,6.932,3313,3909002,"new york city, pornography, sex addiction, co-workers relationship, internet porn, self-loathing, brother sister relationship"
2011 St. Louis Cardinals: The Official World Series Film,10.0,1,0,"baseball, st. louis, missouri, championship, st. louis, world series, texas rangers, arlington, texas"
Adele: Live at the Royal Albert Hall,8.0,93,0,"concert, pop, live, live performance, concert film"
Moneyball,7.3,5527,110206216,"underdog, california, sports, baseball, based on true story, oakland, california, job transfer, oakland athletics, talent manager, statistics, 2000s, major league baseball (mlb), inspirational"
Cowboys & Aliens,5.638,5243,174822325,"spacecraft, sheriff, robbery, escape, arizona, laser, apache nation, native american, based on comic, alien, outlaw, ufo, gunfight, creature, alien invasion, 19th century"
The Education of Dee Dee Ricks,5.2,2,0,woman director
The Dilemma,5.326,891,67112664,"chicago, illinois, adultery, infidelity, truth, married couple, male friendship, dilemma, engine, love, electric car, boyfriend girlfriend relationship, moral dilemma, gambling addiction, secret investigation, affair, best friends, secrets, business partners, wife cheating on husband, longtime friends, friends since college, caught in the act"
Truth be Told,4.0,2,0,"marriage, family relationships"
ID:A,6.0,58,0,"amnesia, violence against women"
Megan Is Missing,6.216,784,0,"rape, predator, based on true story, murder, teenage girl, internet, torture, high school friends, missing person, found footage, abduction, screenlife, pseudo-documentary"
The Case for Christmas,5.3,27,0,"santa claus, trial, saving christmas, lawyer, single father, christmas"
Forget Me Not,5.442,26,0,"talking, soulmates, walking"
