title,vote_average,vote_count,revenue,keywords
Tower Heist,6.114,3084,152930623,"new york city, skyscraper, fbi, thanksgiving, heist, billionaire, parade, high rise, female agent, ponzi scheme, caper comedy, planning, safecracker, recruiting, deceit, lobby"
Himizu,7.021,167,0,"japan, earthquake, tsunami, based on manga, homeless teenager"
Dear Santa,6.3,100,0,"holiday, little girl, rich parents, letter to santa claus, wishes come true, rich girl, christmas story, christmas"
Dr. Ketel - Der Schatten von Neukölln,5.0,4,0,"future, medical profession, neo-noir"
The Unforgettable Norman Wisdom,0.0,0,0,documentary short
The Tenant,3.5,11,0,"mutant, mute"
Quarantine 2: Terminal,5.7,596,0,sequel
Pixie Hollow Games,6.983,294,0,"sports, magic, competition, fairy tale, olympic games, fairy, sport competition, duringcreditsstinger"
The Princess and the Pilot,7.8,138,0,"princess, friendship, marriage proposal, airplane, based on novel or book, flying, freedom, fighter pilot, pilot, air force, forbidden love, nostalgia, engagement, flashback, love, social commentary, airship, falling in love, relationship, fictional war, air battle, pretty girl, childhood friends, fantasy world, bonding, anime"
Pokémon the Movie: White - Victini and Zekrom,6.5,192,28550000,"battle, anime"
The Man on the Train,5.938,16,0,woman director
Monte Carlo,6.786,2287,39800000,"monte carlo, mistaken identity, look-alike, young woman, texan, american abroad"
La vita facile,6.2,113,0,"romantic rivalry, humanitarian work"
W.E.,6.3,302,868439,"auction, beating, bathtub, clothes, woman director"
Martha Marcy May Marlene,6.586,788,3500000,"mind control, rape, sexual abuse, sibling relationship, post-traumatic stress disorder (ptsd), paranoia, group sex, cult, patriarchy, polygamy, connecticut, memory, brainwashing, home invasion, drugged, boundary violations, running away, estranged sister, sexual predator, manipulated woman, drugging someone, frustrated, murderous cult"
"Pierre Étaix, un destin animé",5.7,3,0,"movie business, biography"
Sucker Punch,6.2,4931,89792502,"samurai, escape, asylum, brothel, surreal, surrealism, sword fight, dragon, robot, inmate, alternative reality, lobotomy, war zone, abusive stepfather, rape culture"
Documentary of AKB48 To Be Continued,0.0,0,0,"girl group, akb48, idol documentary"
Max's Victory,6.5,4,0,"hostage, neoliberalism, slovenia, post-socialism"
Page Eight,6.6,317,0,"spy, blackmail, prime minister, mi5, political thriller, intelligence service, secret"
Swallowed Souls: The Making of Evil Dead 2,7.1,11,0,filmmaking
Judy Moody and the Not Bummer Summer,6.1,92,14166853,"competition, family relationships, summer vacation, duringcreditsstinger"
Life in a Day,7.2,241,225861,"clip show, poetic documentary, human spirit"
The Dream of Ivan,5.7,22,0,sports
War Horse,7.3,3552,177584879,"world war i, horse, farm life, execution, trapped, alcoholic, cavalry, plowing, artillery, candid, loving, depressing, compassionate"
Eating Out: Drama Camp,5.8,70,0,"summer camp, lgbt, sex comedy, flirting, trans woman, drama club, gay theme, gay relationship"
Anaagarigam,7.0,1,0,b-grade
Hara-Kiri: Death of a Samurai,7.188,192,5435358,"japan, samurai, asia, honor, poverty, seppuku, code of honor, ronin, shogun, jidaigeki, bushido, daimos, feudal lord, feudal japan, harakiri, daimyô, hara-kiri"
The Speed of Thought,4.5,44,0,"telepathy, national security agency (nsa), fugitive"
Legend of the Millennium Dragon,6.092,60,0,"monk, dragon, anime"
"Filhos de João, O Admirável Mundo Novo Baiano",8.5,2,0,"1970s, community, salvador de bahia, brazil, football (soccer), brazilian music, carnaval"
Priest,5.845,2422,84154026,"vampire, dystopia, post-apocalyptic future, crucifixion, vampire hunter (slayer), disobey, niece, dark hero, dark fantasy, grim, supernatural horror, intense, vibrant"
In the Land of Blood and Honey,5.8,153,303877,"muslim, sibling relationship, bosnian war (1992-95), united nations, woman director"
We Bought a Zoo,6.82,2855,120081841,"countryside, rain, zoo, love, based on memoir or autobiography, animals, hard work, blocked road, zoo animals"
Welcome to Caligola,0.0,0,0,caligola
Rockstar,7.3,211,19660000,"adultery, musical, terminal illness, rebellious youth, heartbreak, rock musical, rockstar"
Motörhead: The Wörld Is Ours Vol 1 Everywhere Further Than Everyplace Else,6.5,7,0,concert
Gnomeo & Juliet,5.895,2032,189712432,"garden, villain, forbidden love, kiss, based on play or musical, orchid, love, animate statue"
60 Seconds of Solitude in Year Zero,3.8,6,0,"anthology, avant-garde, short compilation, portmanteau, one time event"
Underground,4.357,28,0,"monster, underground, rave, military base, psychotic, troglodyte, shocking, genetically modified organism"
TV's 50 Greatest Magic Tricks,0.0,0,0,"magic, magic trick, television"
Ra.One,5.708,353,35911689,"video game, superhero, villain, science fiction, action, adventure"
The Lincoln Lawyer,7.201,3488,85412898,"california, prostitute, based on novel or book, judge, attempted murder, video surveillance, jury, playboy, private investigator, lawyer, crime scene, motorcycle gang, courtroom, defense attorney, divorced father, courtroom drama, car driver, innocent in jail, murder of a prostitute, legal thriller, defense lawyer, attorney client privilege, high-profile client"
Have a Little Faith,6.4,28,0,"pastor, christian film"
Hollywood between Paranoia and Sci-Fi: The Power of Myth,5.5,4,0,woman director
The Great Dictator: The Clown Turns Prophet,6.0,1,0,"biography, political satire, political history, social & cultural documentary, film history"
Pavlopetri: The City Beneath the Waves,7.0,2,0,"lost civilisation, ancient greece, archeology, lost civilization, undersea city, sunken city, historical reinterpretation, underwater archaeology, historical revisionism, historical documentary"
"Atlantis: End of a World, Birth of a Legend",6.0,31,0,"atlantis, end of world, ancient civilization, archeology, based on myths, legends or folklore, lost civilization, mythological, historical reenactment, expert opinion, sunken city, mythological place, historical reinterpretation, extinct civilization, docufiction, historian, mythological story, historical documentary, historical events"
The Dead and the Damned,2.865,26,0,"california, mutant, gold rush, meteor, 19th century"
12 Dates of Christmas,6.1,299,0,"new york city, christmas party, blind date, time loop, falling in love, dead mother, advertising, dog, ex-boyfriend ex-girlfriend relationship, landscape architect, christmas, do over, christmas eve, hockey player"
Crazy Wisdom: The Life and Times of Chögyam Trungpa Rinpoche,5.5,4,86202,"buddhism, buddhist, tibet, woman director"
Biss zur großen Pause - Das Highschool Vampir Grusical,6.0,3,0,vampire
"Last Fast Ride: The Life, Love and Death of a Punk Goddess",8.0,1,0,"san francisco, california, punk rock, drug overdose, punk band, heroin addiction, woman director, bay area"
Making the Boys,4.7,10,33833,"theater play, lgbt, 1960s"
Beginning of the Great Revival,4.488,43,0,"1920s, communist china"
Bud Greenspan Presents Vancouver 2010: Stories of Olympic Glory,5.2,6,0,"sports, olympic games"
"Cooking mo, Cooking ko",5.5,2,0,philippines
The Front Line,7.2,191,15786086,"korean war (1950-53), battle, 1950s, korean army, south korea, north korea"
SMTown Live in Tokyo 2011 (Special Edition),0.0,0,0,"concert, music, tour"
Tomie: Unlimited,4.553,38,0,"japan, supernatural being"
The Chicago 8,5.6,8,0,"anti war, protestors"
Haywire,5.713,1439,33372606,"rescue, mercenary, secret agent, foot chase"
A Sense of Humor,6.028,18,0,"kidnapping, serial killer"
Alice's Lover ~Alice in Underground Wonderland~,3.0,3,0,musical
"St. Henri, the 26th of August",0.0,0,0,woman director
Jorinde und Joringel,4.9,5,0,fairy tale
Polisse,7.773,1278,20374201,"husband wife relationship, paris, france, family relationships, co-workers relationship, extramarital affair, photojournalism, woman director, abused child"
Love,5.509,227,0,"isolation, space, astronaut, space station, solitude"
Tinker Tailor Soldier Spy,6.623,2815,80600000,"london, england, budapest, hungary, espionage, spy, cold war, 1970s, traitor, kgb, secret agent, mi6, mole, british spy, british intelligence, soviet"
The Lost Bladesman,6.3,110,23774400,"based on novel or book, warlord, battle, 3rd century, the lost bladesman"
Islamic Art: Mirror of the Invisible World,6.0,1,0,"art, islamic"
「見逃した君たちへ」チームK 3rd Stage「脳内パラダイス」公演,0.0,0,0,"concert, akb48"
Buddha: The Great Departure,7.5,72,0,"historical figure, based on manga, historical, journey, anime, war"
Delhi Belly,7.0,197,18035000,"gangster, blackmail, delhi, india, dark comedy, polaroid camera"
Gokuraku sentô: Kyonyû yumomi,4.5,6,0,"softcore, pink film"
Michael Flatley Returns as Lord of the Dance,7.9,17,0,"musical, stepping, irish music"
Löwenzahn - Das Kinoabenteuer,4.5,2,0,"treasure hunt, friends, dog"
Jerry Powell & the Delusions of Grandeur,6.0,1,0,"crude humor, black and white, neo-noir, strange"
Marley & Me: The Puppy Years,5.713,150,0,"sequel, puppy, anthropomorphism, dog"
Bob's New Suit,3.1,4,0,gay parent
Adventures of Thunderstorm: Return of Thor,5.2,28,0,"norse mythology, norse god"
Lead Us Not Into Temptation,5.071,14,0,"older man younger woman relationship, woman director"
Tensou Sentai Goseiger vs Shinkenger: Epic on the Silver Screen,6.4,7,0,"samurai, angel, sentai, super sentai, henshin heroes, tokusatsu"
Crayon Shin-chan: Fierceness That Invites Storm! Operation Golden Spy,6.7,17,0,"based on comic, anime"
VeggieTales: Princess and the Popstar,1.0,1,0,"farm, concert, bible, musical, vegetable, anthropomorphism, trading, popstar"
Something Borrowed,6.234,1075,65090821,"new york city, based on novel or book, cheating, pregnancy, birthday party, one-night stand, flashback, crush, lawyer, best friend, wedding, love affair, celebration, childhood friends, awkwardness, lying, duringcreditsstinger, engaged, loyal, liaison, confidant, mismatched couple, secret crush, crazy ex, longtime crush, crush on friend, drunk one-night stand, always the nice one"
A Brief History of Slasher Films,0.0,0,0,"cinema history, slasher horror"
The Edge,5.9,4,0,"woman director, teenager, french"
Suite Precure♪ The Movie: Take It Back! The Miraculous Melody That Connects Hearts!,5.4,8,0,"superhero, precure, supervillain, anime, based on tv series, music, magical girl"
Prince: A Purple Reign,8.0,4,0,"musician, minnesota, prince, biography, record label, 1980s, 1990s, paisley park"
Larry Crowne,5.992,1376,75055070,"classroom, college, diner, teacher, love, loss of job, economics, yard sale, cell phone, scooter, back to school"
Pink Floyd: Whatever Happened to Pink Floyd? The Strange Case of Waters and Gilmour,6.0,2,0,"rock 'n' roll, progressive rock"
AUN: The Beginning and the End of All Things,5.0,4,0,"future, search, energy"
Naruto Shippuden the Movie: Blood Prison,7.248,686,9065101,"ninja, shounen, anime, adventure"
Delicacy,6.3,465,9696204,"france, love, fate, cafe, office romance"
Brian May's Brief History of 3D,7.0,2,0,"stereograph, 3d"
Justin Bieber: Never Say Never,5.2,420,99036827,"canada, manager, prayer, pop singer, music competition, tour bus, teenage boy, pop music, concert film, aftercreditsstinger, duringcreditsstinger, music documentary, teenybopper"
Strange Powers: Stephin Merritt and the Magnetic Fields,6.7,10,0,"songwriter, woman director"
Let My People Go !,5.0,21,0,gay theme
Fliegende Fische müssen ins Meer,5.25,8,0,woman director
Silent House,5.4,432,13101672,"supernatural, remake, beer bottle, real time, candelabra, padlock, woman director"
Electric Daisy Carnival Experience,0.0,0,0,electric daisy carnival
