title,vote_average,vote_count,revenue,keywords
Behind the Camera: The Unauthorized Story of 'Three's Company',3.6,5,0,"roommates, behind the scenes, blonde stereotype"
"Old, New, Borrowed and Blue",6.176,17,0,woman director
"Free Party, en deçà du bien et du mal",0.0,0,0,"underground, techno, counter-culture, rave party"
Destiny's Child World Tour,7.5,2,0,"concert, pop, rhythm and blues (r&b)"
Natale in India,4.866,552,0,"holiday, white rapper, misunderstanding, india, opposites attract, sex comedy, scatological humor, cinepanettone, racist stereotype, culture shock, 2000s"
The Making of 'The Long and Short of It',0.0,0,0,making of
Finding John Christmas,6.2,12,0,christmas
Hockey in Heart,0.0,0,0,"sports, ice hockey, professional hockey player"
A Touch of Spice,6.635,126,0,"grandparent grandchild relationship, spice, greek, teenage crush"
Corazón de melón,5.2,4,0,"love triangle, plus sized woman"
Smart Sharks: Swimming With Roboshark,0.0,0,0,"robot, shark"
Chaplin Today: The Great Dictator,6.4,7,0,"nazi, dictator, comedian, 1940s, short film"
Acda & de Munnik: Groeten Uit Maaiveld Live,0.0,0,0,"concert, musical duo"
No Rest for the Brave,5.5,16,0,"drug dealer, insomnia, rural area, massacre"
E! Entertainment Special: Christina Aguilera,0.0,0,0,"singer, musical history, documentary"
When the Last Sword Is Drawn,7.487,112,2487338,"japan, samurai, based on novel or book, kyoto, japan, jidaigeki, edo period, humanity, shinsengumi, 19th century, past and present, bakumatsu"
Miss Spider's Sunny Patch Kids,8.0,2,0,tv show
Godforsaken!,6.1,39,0,"mass murder, based on true story, crime spree, 1990s"
Crime Spree,5.5,108,0,"chicago, illinois, gangster, fbi, hoodlum, american mafia"
God Has a Rap Sheet,2.0,2,0,"god, jail, devil, homeless man"
Defending Our Kids: The Julie Posey Story,6.8,9,0,woman director
Kal Ho Naa Ho,7.4,426,13214520,"new york city, musical"
A Snake of June,6.8,163,0,"blackmail, rain, surrealism, dysfunctional marriage, photograph"
Secondhand Lions,7.185,804,0,"farm, texas, lion, money, eccentric, veteran, uncle nephew relationship, teenage protagonist"
The Firm - Can't Stop,0.0,0,0,"skateboarding, skateboarder, skate park, skater, skateboard  video, skate"
"Rich Media, Poor Democracy",0.0,0,0,"capitalism, media, educational, telecommunications"
My Father,6.0,1,0,"experiment, nazi, parent child relationship, world war ii, ex-nazi, father son reunion"
Paycheck,6.213,1945,117248958,"amnesia, prophecy, technology, engineer, time, evil corporation, cyberpunk, scientist, millionaire, based on short story, tech noir, seeing the future"
The Erotic Misadventures of the Invisible Man,4.636,22,0,erotic movie
May,6.584,676,264349,"obsession, difficult childhood, bisexuality, fetishism, childhood trauma, imaginary friend, murder, loneliness, serial killer, female protagonist, doll, mental illness, lgbt, character study, socially awkward, independent film, dry humor, lazy eye, admiring"
Kontroll,7.181,279,1277800,"budapest, hungary, underground, subway, allegory, eastern europe, dark comedy, train, pursuit, subterranean, dark, gritty, metro, budapest"
Shanghai Knights,6.138,2371,88323487,"martial arts, london, england, indian territory, emperor, revenge, murder, arrow, duringcreditsstinger, action hero, imperial seal, good versus evil, wistful, disdainful, doubtful, dubious, frustrated, joyful"
His Brother,5.4,23,22352,"sibling relationship, terminal illness, male homosexuality, disease, estranged father, reconciliation, estranged family member, incurable disease"
Baaz: A Bird in Danger,4.7,3,750000,"mayor, painter, murder, serial killer, murder suspect"
Death Squadrons: The French School,9.0,2,0,"fascism, racism, nazi collaborationism, torture victim, illegal militia, police violence, political violence"
"Josee, the Tiger and the Fish",6.9,51,0,"love, based on short story, disability, young love, cerebral palsy"
A Short Film About John Bolton,6.4,10,0,"vampire, painting, artist, inspiration, short film"
Brian Wilson: Presents - Pet Sounds Live in London,8.0,1,0,concert
Those Who Walk in Darkness,10.0,1,0,"superhero, police force"
The Cost of Living,5.7,29,0,money
The Patrice O'Neal Roast,0.0,0,0,roast
In the Cut,5.1,447,23726793,"eroticism, woman director, erotic thriller"
Story of a Mother,9.0,1,0,"fairy tale, mother role, grim reaper"
Barbie of Swan Lake,7.03,1119,0,"magic, musical, ballet, based on toy, female protagonist, animals, unicorn, swan lake, magic land, 3d animation"
Anguish Cry of Predator Bird,6.3,9,0,short compilation
Bloody Murder 2: Closing Camp,4.8,33,0,"summer camp, forest, sequel"
The Powerpuff Girls: 'Twas the Fight Before Christmas,7.2,35,0,"holiday, superhero, santa claus, saving christmas, super power, heroine, female villain, woman director, christmas, based on tv series"
Out of Time,6.3,1256,55495563,"adultery, florida, miami, florida, double murder, deception, murder, divorce, police detective, extramarital affair, surprise-ending"
Last Life in the Universe,7.2,157,0,"sibling relationship, library, suicide attempt, bangkok, thailand, car accident, accidental death, perfectionist"
Gothika,6.114,2416,141591324,"rape, insanity, married couple, car crash, paranormal, confusion, murder, psychiatric hospital, memory loss, mental institution, mental patient, mental illness, vengeful ghost, psychotic, female psychiatrist, repressed memory, accused of murder, desperate, urban gothic, pawn, murdered husband, bewildered, surprise-ending, criminal psychologist"
Musical Chairs,6.7,3,0,"theater play, dysfunctional family, fatherhood"
Cult Culture: The Poseidon Adventure,8.0,2,0,"pop culture, parody, reunion, fan culture, fan club, stage musical, cult cinema, musical comedy"
Blue,6.207,29,0,"adolescence, painting, based on manga, time skip, girls' love (gl), hidden past, lack of communication"
A Minute of Sun Less,0.0,0,0,"tangier morocco, love affair, police inspector, murder suspect"
Baby Looney Tunes: Eggs-traordinary Adventure,6.577,13,0,"holiday, easter, anthropomorphic animal, anthropomorphic"
"Girl's Life, Boy's World",4.792,12,0,"friendship, adolescence, boarding school, group of friends, school life, virility"
The American Hobo: History of the Railriding Worker,6.5,4,0,"murder, riding the rail, hobo"
Behind the Action in 'Biker Boyz',0.0,0,0,"stunt, biker, motorcycle"
Like Asura,6.5,15,0,"family relationships, relationships, based on tv series, four sisters"
"Goodbye, Dragon Inn",6.758,165,0,"cinema on cinema, rain, loneliness, art house, closing down, taipei, mortality, slow cinema, movie theater"
Surplus: Terrorized Into Being Consumers,6.5,37,0,"capitalism, manipulation, consumerism"
Pokémon: Gotta Dance!,6.864,11,0,"anime, original video animation (ova), short film"
Grimm,5.689,37,0,"spain, camera"
Munna Bhai M.B.B.S.,7.191,333,0,"medicine, hospital, medical drama"
Right on Track,6.6,44,0,"sibling relationship, biography, drag racing, drag racer"
Monte Walsh,6.1,42,0,"saloon, based on novel or book, ranch"
Something to Do with Death,6.0,2,0,"cinema on cinema, movie business, behind the scenes, spaghetti western, western filmmaking, celebrity interview, short film"
