title,vote_average,vote_count,revenue,keywords
The Dark Knight,8.525,34824,1004558444,"sadism, chaos, secret identity, crime fighter, superhero, anti hero, scarecrow, based on comic, vigilante, organized crime, tragic hero, anti villain, criminal mastermind, district attorney, super power, super villain, neo-noir, bold"
Kung Fu Panda,7.31,12235,632091832,"martial arts, kung fu, strong woman, china, tiger, bravery, restaurant, villain, shop, panda, sensei, anthropomorphism, fighting, master, destiny, crane, aftercreditsstinger, wuxia, monkey warrior, philosophical, viper, inspirational, lighthearted"
Iron Man,7.654,27519,585174222,"middle east, superhero, arms dealer, malibu, based on comic, aftercreditsstinger, marvel cinematic universe (mcu), counterterrorism"
Twilight,6.284,14101,393616788,"high school, soulmates, based on novel or book, immortality, vampire, forbidden love, teen movie, trust, desire, washington state, duringcreditsstinger, woman director, interspecies romance, based on young adult novel, supernatural power, good versus evil, high school romance, vampire human love, teen fantasy, گرگ و میش"
WALL·E,8.104,19707,521311860,"garbage, dystopia, space travel, distant future, loneliness, robot, aftercreditsstinger, duringcreditsstinger, dystopian sci-fi"
How to Lose Friends & Alienate People,5.999,804,17286299,"new york city, journalist, failure, magazine, based on memoir or autobiography, starlet, british man, cult of celebrity, awards show, celebrity worship, workplace romance, celebrity interview, in crowd"
Indiana Jones and the Kingdom of the Crystal Skull,6.018,8751,786636033,"treasure, mexico city, mexico, saving the world, whip, leather jacket, riddle, maya civilization, peru, machinegun, treasure hunt, alien, nuclear explosion, refrigerator, archaeologist, adventurer, area 51, archeology, 1950s, father son relationship, dignified, vibrant, formiga"
Revolutionary Road,6.979,4007,76000000,"adultery, infidelity, career, jealousy, husband wife relationship, based on novel or book, marriage crisis, american dream, housewife, connecticut, suburbia, free spirit, unhappiness, getaway, aspiring actor, 1950s, unhappy marriage, feeling trapped, bleak"
The Incredible Hulk,6.227,12366,264770996,"new york city, rio de janeiro, superhero, based on comic, fugitive, on the run, super soldier, scientist, virginia, military, super villain, marvel cinematic universe (mcu), angry, radical transformation, good versus evil, intimate"
The Curious Case of Benjamin Button,7.595,13381,335802786,"new york city, navy, funeral, diary, tea, travel, hospital, historical fiction, period drama, magic realism, based on short story, fictional biography, reverse aging"
Journey to the Center of the Earth,6.1,5024,101702060,"based on novel or book, volcano, iceland, prehistory, prehistoric creature, dinosaur"
The Mummy: Tomb of the Dragon Emperor,5.509,4663,403449830,"china, sword, pyramid, mummy, yeti, chinese emperor, tomb, great wall of china, terracotta army, 1940s, 3rd century bc"
Taken,7.398,11768,226830568,"rescue, paris, france, kidnapping, prostitution, sex trafficking, albanian, missing daughter, ex special forces, ex-cia agent, abduction, search for daughter, army veteran"
You Don't Mess with the Zohan,5.721,3948,204313400,"new york city, israel, palestinian-israeli conflict, mossad, middle east, hairdresser, secret identity, ladykiller, heart-throb, zionism, hairstyle, hacky sack, nemesis, soldier, falling in love, counterterrorism, developers, terrorist threat, famous, sex"
Wanted,6.521,7387,342463063,"mission of murder, secret base, secret organization, instinct, train crash, revenge, betrayal, fate, based on graphic novel, healing process, hidden powers, legacy, secret code, trainsurfing, weapons training, office worker, physical training, intense, assassins, extraordinary powers, vibrant, murder of father"
A Woman in Berlin,6.569,65,1863939,"secret love, berlin, germany, rape, strong woman, love of one's life, world war ii, soviet military"
Tyler Perry's The Family That Preys,6.73,89,37100000,"husband wife relationship, female friendship, family business , betrayal, single mother, family conflict, arrogance, construction worker, snobbery, cross country trip, working woman, ungrateful child, wealth differences, atlanta, georgia, christian woman, wealthy family, mother son relationship, mother daughter relationship, black cinema, secrets, business owner, construction company owner, working class family, lifelong friendship, contention, unethical business practices"
Ponyo,7.8,4609,202404009,"princess, fish, cliff, mermaid, anime, lighthearted, sentimental, adventure, whimsical"
Barbie and the Diamond Castle,7.416,870,0,"magic, musical, female friendship, based on toy, female protagonist, 3d animation, music"
Eagle Eye,6.479,3018,178800000,"artificial intelligence (a.i.), washington dc, usa, technology, hostage, secret identity, fbi, pentagon, twin brother, terrorism, human vs computer"
Madagascar: Escape 2 Africa,6.523,7213,603900354,"dance, friendship, jealousy, airplane, africa, hunger, lion, zoo, hippopotamus, giraffe, chimp, penguin, cartoon, villain, volcano, zebra, sequel, slapstick comedy, madagascar, friends, shark, animals, duringcreditsstinger, lemur, talking animal"
Step Up 2: The Streets,6.689,2363,150988382,"underdog, hip-hop, street gang, scholarship, competition, breakdance, insurgence, heart-throb, tap dancing, ballet"
Bolt,6.534,6345,309979994,"hamster, human animal relationship, talking dog, animals, cat vs dog, duringcreditsstinger, talking cat, pets, dog cat friendship, animal lead, joyful"
Asterix at the Olympic Games,5.2,2061,131856927,"colosseum, wild boar, magic, competition, olympic games, greece, emperor, horse, roman, governance, based on comic"
Merlin and the War of the Dragons,4.0,40,0,"england, magic, surreal, dragon, king, middle ages (476-1453), dark ages"
The Wave,7.485,3498,32350637,"high school, experiment, dictator, gymnasium, trainer, classroom, fascism, national socialism, violence in schools, training, education, squatter, anarchist, homepage, high school teacher, philosophical, water polo, autocracy"
"Küss mich, wenn es Liebe ist",7.2,3,0,"funeral, bank, business woman, workplace, bakery, inheritance, falling in love, loan, ghost"
The Day the Earth Stood Still,5.654,3615,233093859,"spacecraft, government, panic, extraterrestrial technology, ultimatum, evacuation, tank, alien, remake, ufo, end of the world, social commentary, giant robot, power outage, interrogation, environmentalism, threat, alien contact, messenger, nanobots, disintegration"
Karajan: Beauty As I See It,0.0,0,0,"biography, orchestra conductor"
Michael Ballhaus - Eine Reise durch mein Leben,0.0,0,0,woman director
Vacancy 2: The First Cut,5.3,288,0,"motel, snuff, prequel, dark killer, truck driver, night vision, room key, videotape, voyeur, control room, dark room"
C'est mieux la vie quand on est grand,0.0,0,0,"based on novel or book, foster home"
Harold & Kumar Escape from Guantanamo Bay,6.303,1565,43493123,"guantanamo bay, road trip, guantánamo, cannabis, terrorism, east asian lead, buddy, stoner, aftercreditsstinger, duringcreditsstinger, stoner movie, amused"
A Matter of Loaf and Death,7.344,575,0,"bomb, bakery, romance, anthropomorphism, murder, stop motion, serial killer, dog, animal abuse, claymation, plasticine, advertising model, short film"
Next Avengers: Heroes of Tomorrow,7.04,300,3800000,"future, based on comic, super power, superhero team, hope for future, teen superhero, animation, son of superhero"
Quantum of Solace,6.336,8263,589593688,"undercover, killing, secret agent, mi6, british secret service, intense, powerful, vibrant"
Tinker Bell,6.9,1525,9208064,"fairy, spring, gardening"
The Babysitter,6.6,13,0,short film
Beverly Hills Chihuahua,5.382,1088,149281606,"dog dirt, pinata, potted plant, duringcreditsstinger, chihuahua dog"
The Great Buck Howard,6.0,262,900689,"career, magic show, comeback, drop-out"
Tropic Thunder,6.698,6674,195702811,"vietnam, movie business, satire, parody, jungle, movie star, southeast asia, land mine, shackles, taunting, duringcreditsstinger, blackface, method acting, satirical, playful, provocative, critical, hilarious, amused, audacious, bold, exuberant, inflammatory, sarcastic, sardonic"
The Memory Keeper's Daughter,6.4,39,0,"down syndrome, twins"
Open Season 2,5.9,1265,8700000,"deer, sequel, bear, dog, animals, dachshund"
The Hurt Locker,7.259,5940,49259766,"rescue, sniper, explosive, loyalty, us army, car bomb, iraq, tension, disaster, terrorism, soldier, iraq war, booby trap, anti war, bomb squad, body armor, woman director, army sergeant, unexploded bomb, weapons of war, dramatic, violence, bomb disposal unit, disarming a bomb"
In Your Absence,5.9,23,0,"coming of age, rural area, lgbt, lgbt teen"
Fire Squad,6.0,1,0,"fire, firefighter"
Welcome to the Sticks,6.698,2516,245144417,"jealousy, clock tower, provence, southern france, lie, postman, mama's boy, bias, local speciality, relocation, prejudice, cultural difference, job transfer, northern france, bell tower, postal worker, hospitality, community spirit, dialect, small community, wine drinking, unhappy marriage, social prejudice, accents, disability fraud"
The Headless Woman,6.2,121,100177,"hit-and-run, woman director"
What Happens in Vegas,6.108,3195,219400000,"hotel, casino, roommates, romcom, rivalry, wedding, las vegas, drinking, opposites attract, aftercreditsstinger, marriage counselling, accidental marriage, vegas wedding, credits cookie"
Crime Is Our Business,5.883,94,0,"based on novel or book, married couple, murder, witness to murder, cadaver"
Gran Torino,7.989,11234,270000000,"rape, war veteran, gangster, immigration, old man, priest, gang, detroit, michigan, widower, hmong"
Ghost in the Shell 2.0,7.413,442,0,"future, android, cyborg, dystopia, cyberpunk, anime, philosophical, ambiguous"
Nim's Island,5.9,1166,100104565,"daughter, exotic island, shipwreck, cruise, volcano, e-mail, turtle, liana, anthropomorphism, author, pirate, woman director, iguana, sea lion"
The Happening,5.395,3821,163403799,"suicide, husband wife relationship, tree, natural disaster, crisis, park, nature, strange behavior, virus, unexplained, toxin, unprecedented"
"Well, We Were Lucky with the Weather – Again",3.357,14,0,"sweden, summer vacation"
Glamour vs. Paparazzi,0.0,0,0,"paparazzi, hollywood star, celebrity photographer"
Gingerdead Man 2: The Passion of the Crust,4.6,56,0,"darkness, beatnik, murder"
Auge in Auge - Eine deutsche Filmgeschichte,6.3,3,0,"new love, cinema on cinema, movie business"
Jack Says,4.5,3,0,memory loss
Meet the Spartans,4.098,1786,85897593,"army, dance performance, fight, queen, penguin, parody, black hole, spoof, s.a.t., aftercreditsstinger, duringcreditsstinger, playful, irreverent, farcical, mocking, ridiculous, sarcastic"
Horton Hears a Who!,6.51,3451,298572799,"rescue, elephant, jungle, who, cartoon elephant, dr. seuss"
Starship Troopers 3: Marauder,4.853,563,0,"space marine, starship, creature, marauder"
Diary of a Nymphomaniac,5.6,349,0,"eroticism, nymphomaniac, prostitution, softcore, red dress, promiscuous past, nymphomania"
Unstable Fables: Tortoise vs. Hare,5.7,32,0,"computer animation, race, tortoise, rival, hare"
Barbie in 'A Christmas Carol',7.166,574,4496912,"based on toy, female protagonist, christmas, 3d animation"
The Mysteries of Pittsburgh,4.1,52,0,"based on novel or book, college, summer, graduate"
The Boy in the Striped Pyjamas,7.819,7466,20416563,"based on novel or book, nazi, nationalism, concentration camp, world war ii, gas chamber, concentration camp prisoner, children in wartime, anxious"
The Reader,7.466,3285,108902486,"based on novel or book, germany, war crimes, women's prison, trial, female prisoner, reading aloud, love affair, cynical, law student, teenage sexuality, older woman younger man relationship, reading to someone, secret lover, shame, literacy, frantic, west germany, courtroom drama, complex, cautionary, depressing, cruel, disheartening, embarrassed, tragic"
Skirt Day,7.1,183,0,"adolescence, hostage, ghetto, teachers and students"
"Can I Be Your Bratwurst, Please?",4.6,8,0,"hotel, porn star, hollywood, lgbt, erotic movie, christmas, gay theme, short film"
The Pirates Who Don't Do Anything: A VeggieTales Movie,5.7,80,13247725,"sibling relationship, vegetable, anthropomorphism, computer animation, pirate, king, aftercreditsstinger, duringcreditsstinger, good guy"
Por Toda Minha Vida - Mamonas Assassinas,7.0,1,0,biography
199 recetas para ser feliz,2.4,5,0,threesome
The King of the Hill,5.7,70,0,"mountain, murder"
Death Race,6.29,3991,76000000,"prison, martial arts, car race, dystopia, matter of life and death, car crash, prison guard, prison escape, exploding building, vehicle combat, street race, remake, car fire, action hero, death game"
The Chaser,7.75,1444,0,"prostitute, kidnapping, psychopath, pimp, investigation, gore, rope, based on true story, flu, serial killer, psychological thriller, cell phone, dog, tied up, meat hook, chisel, seoul, south korea, tense"
What Just Happened,5.4,465,6673422,"midlife crisis, movie business, divorce"
The Letter for the King,5.833,27,0,"mission, based on novel or book, sword fight, knight, medieval"
Rambo,6.687,4130,113200000,"snake, fight, missionary, boat, river, pastor, border, mercenary, thailand, burma, sequel, hard, disturbed"
The Secret Life of Bees,7.5,559,39952437,"melancholy, woman director, shocking, hopeful"
Tokyo Gore Police,5.947,346,0,"mutant, police chief, head wound, engineer, remake, revenge, engineering, cyberpunk, crooked cops, wounds to weapons"
The First Day of the Rest of Your Life,7.476,494,13200000,"marriage, diary, wine, car crash, student of medicine, family, family feud"
Fire and Ice: The Dragon Chronicles,5.1,72,0,"fire, kingdom, knight, dragon, king"
Over Her Dead Body,5.5,477,0,"california, veterinarian, diary, romcom, best friend, dating, falling in love, spirit, accidental death, psychic, caterer, freak accident, ice sculpture, wedding day, moving on, relationship sabotage, brother sister relationship, deep sadness, death of fiancée, psychic medium"
Love Under the Sign of the Dragon,2.667,3,0,lovestory
The Sisterhood of the Traveling Pants 2,6.3,795,44352417,"female friendship, best friend, summer vacation, woman director, young adult, based on young adult novel"
Mamma Mia!,6.976,6840,609841637,"single parent, parent child relationship, greece, musical, romcom, based on play or musical, unknown father, single mother, based on song, poem or rhyme, hotel manager, young love, greek island, duringcreditsstinger, woman director, imminent wedding, mother daughter relationship, jukebox musical, past history, daughter's wedding, abba, comforting, enthusiastic"
Departures,7.843,881,69932387,"dying and death, funeral, octopus, coffin, cello, musical, based on memoir or autobiography, odd job, yamagata"
Hellboy: In Service of the Demon,6.923,13,0,"movie business, making of"
Let the Right One In,7.5,3128,10785801,"based on novel or book, vampire, sweden, bullying, castration, bully, child vampire, murder, androgyny, new neighbor, nostalgic, young love, romantic, vampiro"
The Muppets - Studio DC - Almost Live,8.0,2,0,puppetry
I Always Wanted to Be a Gangster,7.3,87,0,"waitress, paris, france"
The Chronicles of Narnia: Prince Caspian,6.627,6613,419665568,"witch, sibling relationship, based on novel or book, faith, lion, wretch, prince, matter of life and death, uncle, family relationships, sequel, battle, based on children's book, fantasy world, 1940s, high fantasy, isekai, based on young adult novel, good versus evil"
Revolution! The Making of 'Bonnie and Clyde',4.6,5,0,behind the scenes
"Xaviera Hollander, the Happy Hooker: Portrait of a Sexual Revolutionary",2.0,2,0,"author, dutch, xaviera hollander, the happy hooker, former call girl, the happy hooker: my own story"
Codename: Kids Next Door: Operation I.N.T.E.R.V.I.E.W.S.,8.3,29,0,"knd, código: knd, los chicos del barrio"
Behind the Walls,6.3,12,0,"france, approved school , orphan, based on memoir or autobiography, 1930s"
Monty Python: Before the Flying Circus,7.8,4,0,black and white
Vantage Point,6.398,2096,152039882,"sniper, spain, usa president, bomb, media, chaos, kidnapping, terrorism, body double, secret service, summit, multiple perspectives, assassination of president, american tourist, counterterrorism, u.s. secret service agent, salamanca, spain, camcorder, eyewitness account, rashomon effect, international news"
Se sarà luce sarà bellissimo - Moro: Un'altra storia,0.0,0,0,"reenactment, years of lead, brigate rosse (red brigades) terrorist group, anni di piombo, aldo moro"
The Deal,5.4,72,0,romcom
Street Kings,6.638,1603,66476363,"corruption, police, machinegun, ghetto, alcoholism, murder, undercover cop, shootout, dirty cop, rogue cop, los angeles, california, widower, police funeral, neo-noir, planted evidence"
Mawson: Life and Death in Antarctica,4.0,1,0,"pole, wilderness, heroism, recreation, survival, antarctica, endurance, blizzard, explorer, trek, mawson, south pole"
My Prison Yard,5.8,18,0,woman director
The Poker House,6.177,144,0,"rape, drug abuse, woman director"
Miss Pettigrew Lives for a Day,6.774,411,16724933,"london, england, based on novel or book, england, jazz singer or musician, jazz club, love affair, pianist, governess, high fashion, eve of world war ii"
In Bruges,7.496,5529,34533783,"drug dealer, hitman, tourist, dark comedy, bruges, belgium, church, guilt, death, town square, vietnamese, canadian stereotype, neo-noir, christmas, irish, cheerful, excited"
Proyecto Dos,5.0,3,0,clone
Justice League: The New Frontier,6.8,544,5231128,"superhero, based on comic, super power, cold war era"
Man on Wire,7.363,925,2957978,"judge, 1970s, juggler, street artist, jail, fame, hiding, tower, tightrope, world trade center, notre dame cathedral"
Red Cliff,7.115,860,250100000,"martial arts, china, flaming arrow, strategy, carrier pigeon, wall of fire, white dove, casualty of war, chinese painting, broken arrow, 3rd century"
Gurren Lagann The Movie: Childhood's End,7.6,112,957621,"dystopia, mecha, giant robot, compilation, edited from tv series, anime, super robot"
Jumper,6.163,6045,222231186,"adolescence, based on novel or book, teleportation, chase, fight, loss of loved one, motherly love, super power, dramatic, suspenseful, incredulous, complicated"
CJ7,7.309,761,47301471,"little boy, ufo, extraterrestrial, poverty, single father, construction worker, alien friendship, zealous, candid, father son relationship, hilarious, whimsical, admiring, adoring, enthusiastic, familiar, joyful, vibrant"
Slumdog Millionaire,7.728,11021,378400000,"based on novel or book, slum, cheating, suspicion, mumbai (bombay), india, game show, quiz, orphan, duringcreditsstinger, taj mahal, india, defiant"
Band from TV: Hoggin' All the Covers,0.0,0,0,blues
Another Cinderella Story,7.312,2090,0,"high school, dance, dancer, fairy tale, masked ball, musical, celebrity, orphan, modern fairy tale, cinderella"
The X Files: I Want to Believe,5.845,1585,69363381,"extraterrestrial technology, fbi, alien, priest, hospital, duringcreditsstinger, based on tv series"
Journey to the Center of the Earth,4.875,60,0,"travel, dinosaur"
Company: A Musical Comedy,7.5,26,0,"birthday, bachelor, married couple, marriage, theater play, musical, birthday party, stage show, based on play or musical, romance, friends, live, relationship, commitment, filmed theater, musical proshot"
Telstar: The Joe Meek Story,5.5,32,0,"pop, joe meek"
True Confessions of a Go-Go Girl,4.7,13,0,"dancer, pole dancer"
Wild Child,6.7,1884,22000000,"diving, england, boarding school, girls' boarding school, malibu, spoiled child, teen movie, lacrosse, school, love interest, laptop, discipline, intimidation, school mate, change of plan, girls' school"
Prom Wars: Love Is a Battlefield,4.1,7,0,prom
The Worst Horror Movie Ever Made: The Re-Make,1.8,5,0,"rape, mad scientist, murder, on the run, hillbilly, lactation, genie, abortion, forced abortion, arab stereotype"
Jag vill inte leva detta livet,8.0,2,0,"addiction, drug use"
Never Back Down,6.778,2416,41627431,"high school, martial arts, sports, fight, underground, rebel, training, champion, revenge, nemesis, club, brawl, aggressive, vibrant"
21,6.694,4897,159808370,"friendship, card game, casino, gambling, professor, harvard university, cohabitant, college, girlfriend, studies, dormitory, blackjack, las vegas, derogatory, frustrated"
The Class,7.0,698,28814580,"immigrant, class society, paris, france, literature, boredom, socially deprived family, illegal immigration, violence in schools, education, multiculturalism, republicanism, teacher, school, high school teacher, school life, teachers and students, french teacher, teenager"
Dragon Ball: Yo! Son Goku and His Friends Return!!,6.468,577,0,"martial arts, fight, alien, shounen, anime, tv special"
Radiohead: In Rainbows - From the Basement,7.8,34,0,"concert, rock 'n' roll, live, rock band, alternative, reflective"
The Masterpiece That Almost Wasn't,6.5,4,0,"italian american, godfather, filmmaking"
A Frozen Flower,6.9,151,18980744,"adultery, romance, sword fight, tragedy, betrayal, lgbt, goryeo dynasty, gay theme, boys' love (bl), psychological romance"
Wenn Mutti wüsste...,0.0,0,0,"gay theme, short film"
Foo Fighters: Live At Wembley Stadium,8.236,36,0,"concert, live performance, rock concert"
Beyond Loch Ness,4.531,51,0,"monster, fishing, sea monster, severed leg, loch ness monster, loch ness, canuxploitation, female sheriff, lake superior, plesiosaur, abandoned mine, cryptozoologist"
Death in Venice: The Sinking Palazzo,6.0,3,0,movie business
Bezerra de Menezes: O Diário de um Espírito,5.4,7,1948414,spiritism
Royal Opera House: Salomé,3.0,3,0,"opera, seduction, based on play or musical, severed head"
Female Agents,6.571,269,0,"london, england, loss of loved one, resistance, world war ii, normandy, france, d-day, commando, 1940s"
Killer Bean Forever,7.2,183,2025017,"gangster, 3d animation"
God's Offices,6.7,17,0,"women's sexual identity, safe sex, pill, contraception, reproduction, woman director, family planning"
Bleach the Movie: Fade to Black,7.1,188,6032296,"amnesia, supernatural, shounen, anime, adventure"
Waltz with Bashir,7.7,1021,11179372,"israel, palestinian-israeli conflict, palestine, middle east, nightmare, mass murder, massacre, adult animation, sabra, shatila, lebanon, beirut, animated documentary"
Classic Albums: John Lennon - Plastic Ono Band,5.9,7,0,"archive footage, music history, record album, old footage, celebrity interview, music documentary, rock, figure study"
A Year Ago in Winter,6.231,39,0,woman director
A Simple Heart,6.7,14,0,woman director
The Secrets of Jonathan Sperry,6.8,20,1169828,"bible, male friendship, bullying, coming of age, unlikely friendship, religious film, pre-teen, adult child friendship, christian film, christian faith, independent film"
Help! I'm No Bigger Than a Bug,7.0,1,0,"garden, bug, nature"
Eden Lake,6.83,1979,3984669,"lake, beach, husband wife relationship, sadism, camping, rottweiler, bullying, forest, revenge, survival, fear, couple, united kingdom, gang violence, teenage killer, baffled"
Ong Bak 2,6.42,675,8936663,"martial arts, thailand, sequel, muay thai, revenge, slave trade, elephants"
Me Two,5.351,67,2180120,"double life, singer"
Dark Fellowships: The Vril,0.0,0,0,"nazi, secret society"
Resident Evil: Degeneration,6.8,1140,403117,"biological weapon, dystopia, post-apocalyptic future, infection, zombie, based on video game, adult animation, anime, genetic mutation"
The Legend of Bloody Mary,3.071,14,0,"witch, monster, indiana, usa, magic, college, priest, series of murders"
A Whore And a Chick,5.0,3,0,short film
Dragonlance: Dragons of Autumn Twilight,5.5,46,0,"twilight, magic, sorcerer, dragon, role playing game, adult animation, ghost, unicorn, wizard, goblin, quest, high fantasy, healer, chronicles, d&d"
Taxi to the Dark Side,6.941,244,274661,"taxi, afghanistan, guantanamo bay, torture chamber"
Directed by Sidney Lumet: How the Devil Was Made,5.3,3,0,"making of, documentary short"
How She Move,4.7,36,0,"dancing, dance, loss of loved one, stepping"
God on Trial,6.757,68,0,"holocaust (shoah), auschwitz-birkenau concentration camp, debate"
Still Walking,7.762,414,3511120,"family relationships, bereavement, family reunion, family gathering, father son conflict, father son relationship, mother son relationship"
The Strangers,6.131,2577,83051676,"mask, murder, serial killer, slasher, home invasion, psychological horror, absurd"
Gotham Uncovered: Creation of a Scene,7.0,11,0,special feature
The Underdog Knight,6.618,35,1167457,"kung fu, bodyguard, art museum"
Valkyrie,6.945,3936,200276000,"friendship, suicide, plan, berlin, germany, husband wife relationship, assassination, nazi, bomb, resistance, military officer, world war ii, treason, deception, german officer, colonel, medal, operation valkyrie"
Boogeyman 3,5.2,242,156941,boogeyman
Between 11 and 12,0.0,0,0,"stockholm, sweden, short film"
Yeti: Curse of the Snow Demon,4.221,61,0,"himalaya mountain range, yeti, cryptologist, cryptozoologist, plane crash"
Peyote to LSD: A Psychedelic Odyssey,5.6,5,0,"new mexico, lsd, botanist, amazon rainforest, ayahuasca, magic mushroom, explorer, anthropologist, peyote, traditional medicine, indigenous peoples, oaxaca"
Public Enemies: The Golden Age of the Gangster Film,6.9,7,0,"narration, mobster, shootout, gunfight, machine gun"
14-18: The Noise & the Fury,7.4,5,0,"world war i, 1910s"
Mommy Is at the Hairdresser's,6.4,19,0,"gay parent, woman director, gay theme"
Haber,7.0,3,0,"fritz shimon haber, shimon haber, haber"
Roman Polanski: Wanted and Desired,6.331,74,0,"biography, woman director, crime"
