title,vote_average,vote_count,revenue,keywords
La Seconde Surprise de l'amour,0.0,0,0,"theater play, french literature"
Louisa May Alcott: The Woman Behind Little Women,7.0,1,0,"biography, author, novelist, female writer"
Hired Help,0.0,0,0,"short film, thriller"
True Confessions of a Hollywood Starlet,5.1,35,0,"high school, indiana, usa, secret identity, rehabilitation, paparazzi, aunt, scandal, alcoholism, celebrity, fame, hollywood, intoxication, price of fame, famous"
Dicke Liebe,0.0,0,0,"photographer, dressmaker, fashion designer, model, exhibition, fashion show, catwalk"
The Metropolitan Opera: La Fille du Régiment,7.0,1,0,"opera, switzerland, slapstick comedy, soldier, army life, nobility, 19th century"
I.T.A.L.Y. (I Trust and Love You),10.0,1,0,philippines
"NEWS ZERO Spinoff: ""Ponyo on the Cliff"" Close-Up! Five Genius Craftmen",0.0,0,0,"interview, studio ghibli"
Tori Amos: Live at Montreux 1991/1992,5.5,3,0,live concert
Be Kind Rewind,6.3,1416,30600000,"delusion, nuclear power plant, video store, videotape"
The Babysitters,6.004,526,44852,"daughter, adultery, high school, babysitter, business idea, cabin, statutory rape, train, prostitution, older man younger woman relationship, drugs, teenage sexuality, unhappy marriage"
Rated R,5.2,16,0,"madrid, spain, cinema on cinema, 1970s, film in film, woman director"
My Very Best Friend,6.5,12,0,woman director
The Garden of Sinners: Paradox Spiral,7.6,102,0,"based on novel or book, supernatural, adult animation, anime, based on light novel"
Speed Racer,6.329,1703,93900000,"car race, loss of loved one, chimp, family, duringcreditsstinger, woman director, live action remake, based on tv series, euphoric"
The Garden of Sinners: Oblivion Recording,6.7,86,0,"amnesia, magic, supernatural, super power, adult animation, anime, based on light novel"
Christmas on Mars,4.7,12,0,"musical, martian, christmas"
The Secret of Loch Ness,7.0,12,0,mythical creature
Portrait of a Beauty,6.2,38,0,"eroticism, joseon dynasty (1392–1910)"
Vaccine Nation,0.0,0,0,"vaccine, pseudoscience"
Marley & Me,7.188,4714,255700000,"journalist, based on novel or book, melancholy, puppy, love, dog, nostalgic, duringcreditsstinger, pets, columnist, animal lead, pet ownership, sentimental, whimsical, ambivalent, amused, antagonistic, apathetic, apologetic, appreciative, approving, arrogant, assertive, audacious, authoritarian, awestruck, baffled, bold, callous, celebratory, commanding, compassionate, complicated, defiant, demeaning, derogatory, disapproving, disdainful, disheartening, earnest, embarrassed, empathetic, enchant, enraged, enthusiastic, exhilarated, exuberant, familiar, farcical, frightened, frustrated, ghoulish, harsh, impartial, inflammatory, informative, joyful, matter of fact, mean spirited, melodramatic, pessimistic, sarcastic, sardonic, scathing, sceptical, skeptical, straightforward, sympathetic, tragic, vibrant"
Takut: Faces of Fear,5.8,12,0,anthology
Ice Blues: A Donald Strachey Mystery,5.304,23,0,"new york city, based on novel or book, senator, politician, murder, private investigator, lawyer, lgbt, murder investigation, gay theme, gay couple"
"It's Not Funny, It's Art",0.0,0,0,"art gallery, short film"
"I padroni del mondo - UFO, militari e pericolo atomico",10.0,1,0,"ufo, documentary"
Scooby-Doo! and the Goblin King,7.649,272,0,"fairy, halloween, pumpkin, talking dog, duendes, rei dos duendes, goblin king"
Born in 68,5.703,32,0,"lovers, hippie lifestyle, nudism, gay theme"
For the Love of Grace,4.056,9,0,"infidelity, dancing, fire, ritual, dinner"
Role Models,6.484,2035,92380927,"friendship, camping, community service, minotaur, break-up, role playing game, boyfriend girlfriend relationship, duringcreditsstinger, pessimist, bad attitude, energy drink, bad day, larp, lighthearted, hilarious, negativity, big brother program, dead end job"
I'll Never Die Alone,5.209,43,0,"rape, violence against women, rape victim, revenge, drugs, rapist, rape and revenge"
The Machine Girl,5.989,218,0,"man vs machine, cyborg, vomit, living machine, girl heroine, female protagonist, schoolgirl, gatling gun, high school girl, absurd"
Bigg Snoop Dogg Presents: The Adventures of Tha Blue Carpet Treatment,0.0,0,0,"hip-hop, music video"
The Dissection of Thanksgiving,0.0,0,0,thanksgiving
Manson's Missing Victims,5.5,2,0,manson family murders
The Who - At Kilburn 1977,7.8,5,0,concert
Crush and Blush,6.304,23,0,"love affair, school teacher, woman director"
Flashbacks of a Fool,6.2,142,1107542,"funeral, past, hedonism"
Daydream Obsession 3: Legacy,3.0,6,0,"sequel, softcore, father son relationship, video diary, gay theme"
City of Ember,6.3,1828,17869048,"underground world, dystopia, mayor, post-apocalyptic future, puzzle, steampunk, box, pipeworks"
Milk,7.23,2324,54600000,"california, election campaign, politics, homophobia, san francisco, california, 1970s, mayor, politician, biography, based on true story, murder, male homosexuality, morality, election, biting, lgbt, candlelight vigil, lgbt activist, mayoral campaign, gay history, gay theme, gay rights, cautionary, intense, antagonistic, enraged, inflammatory"
Boogie Man: The Lee Atwater Story,7.7,13,0,"usa president, media, politics, blues, bible, politician, interview, cynicism, president, ronald reagan"
Vaatjie gets owned,5.8,3,0,afrikaans
D Tour: A Tenacious Documentary,7.2,6,0,music tour
A Film with Me in It,6.1,77,0,"dead body, landlord, ireland, dog"
Doraemon: Nobita and the Green Giant Legend,6.8,46,31684949,anime
Forgetting Sarah Marshall,6.5,3584,105173115,"rock star, ex-girlfriend, hawaii, beauty, vacation, one-night stand, celebrity, break-up, dumped"
Zack and Miri Make a Porno,6.338,2567,42105111,"pornography, love of one's life, platonic love, pornographic video, best friend, sex comedy, friends in love, duringcreditsstinger, porno"
The Garden of Sinners: Remaining Sense of Pain,7.0,113,0,"supernatural, gore, revenge, super power, adult animation, anime, based on light novel"
1½ Ritter - Auf der Suche nach der hinreißenden Herzelinde,4.327,122,16680689,"princess, knight"
Noah's Arc: Jumping the Broom,5.9,15,0,"coming out, rapper, marriage, wedding, martha's vineyard, lgbt, black lgbt, gay theme"
Another Day In Paradise,5.5,6,0,"pilot, marine"
The Midnight Meat Train,6.17,1200,3533227,"photographer, gore, butcher, vegetarian, stalking, subway train, urban gothic"
WarGames: The Dead Code,5.1,141,0,"computer, washington dc, usa, bomb, video game, death of father, sequel, nuclear threat, warcraft, defcon"
Che: Part One,6.814,792,0,"hero, central intelligence agency (cia), cuba, biography, che guevara, fidel castro, cuban revolution, 1950s"
Dance of the Dragon,6.0,9,0,dance
Kraftwerk and the Electronic Revolution,8.8,4,0,"synthesizer, electronic music, west germany, krautrock"
Fighting Express Vol 1: Battle Run,5.0,1,0,"journalist, fighting, corrupt politician, female journalist, delivery service"
"One Piece: Episode of Chopper Plus: Bloom in the Winter, Miracle Cherry Blossom",7.061,148,8654110,"remake, compilation, pirate, shounen, anime"
April Fool's Day,4.322,97,0,"revenge, prank, april fool's day, rich family"
Inkheart,6.295,2192,62803180,"fairy tale, supernatural, eavesdropping, writer's block, unicorn"
Snakes and Earrings,6.231,39,0,"based on novel or book, pain, love-hate relationship, love, body modification, tattooist"
The Sea at the Time of the Eclipse,0.0,0,0,"sea, underwater"
Vashti Bunyan: From Here to Before,5.7,3,0,singer
The Last Princess,5.9,17,8510570,"princess, jidaigeki, historical drama, sengoku period"
Seven Pounds,7.604,7048,168167691,"sadness, vegetarian, tax collector, blind, pianist, organ transplant, blood type, sad story, admiring, surprise-ending"
"War, Inc.",5.5,289,1296184,"hitman, political satire"
Balancing Acts: A Jewish Theatre in The Soviet Union,0.0,0,0,"soviet union, jewish, documentary short, historical documentary, jewish theatre, solomon mikhoels, moscow state jewish theater, assassinated in minsk"
Melodrama Habibi,6.5,1,0,singer
My Mom's New Boyfriend,5.43,258,7926601,"paris, france, louvre museum, suspicion, gang of thieves, art thief, drastic change of life, widowed mother, awkward situation, mother son relationship, fbi agent, shreveport, louisiana, mother's boyfriend, spying, mother dating, protective son"
The Crimson Wing: Mystery of the Flamingos,7.2,54,0,"africa, tanzania, wildlife, flamingo, young animal, animal behaviour, animal story, animals & nature, animal documentary, disneynature"
Performance Anxiety,3.5,4,0,"musician, lgbt, opposites attract, brisbane, gay relationship, gay couple"
Until the Light Takes Us,6.731,106,0,"murder, black metal"
The Red Baron,6.596,272,2783332,"army, airplane, flying, nurse, world war i, pilot, based on true story, flight, aviation, 1910s, 1900s"
Immigrants (L.A. Dolce Vita),4.975,20,0,adult animation
Senior Skip Day,4.8,55,0,"high school, house party, principal, school principal, debauchery, skipping school, sex comedy, wild party, truancy, senior high school students"
Admiral,6.3,155,38135878,"st. petersburg, russia, 1910s"
Britney: For the Record,7.6,39,0,"dancer, pop, pop culture, pop singer, popstar"
Kamen Rider Kiva: King of the Castle in the Demon World,6.9,8,6576399,"superhero, super power, tokusatsu"
The One-Handed Trick,6.2,18,404075,"hip-hop, drugs, social injustice, disability, social issues"
Nights in Rodanthe,6.257,610,84375061,"beach, based on novel or book, marriage crisis, north carolina, romance, inn, valentine's day, middle age"
The Brothers Bloom,6.558,686,5530764,"new jersey, con man, heiress, caper comedy, estafa, orphan siblings"
Global Metal,7.3,73,0,"interview, heavy metal, music festival, anthropology, cult music band, music documentary, music culture, observational documentary, origins, metal band, metal music, metal singer"
Bringing Godzilla Down to Size: The Art of Japanese Special Effects,8.4,12,41347,"interview, dvd extra, documentary, bonus feature, tokusatsu"
Australia,6.588,2382,211787511,"australia, missionary, world war ii, ranch, cattle drive, racist, prejudice, suspicion of adultery, australian outback, 1940s, 1930s, stampede, trampled to death"
Stories on Human Rights,2.2,4,0,woman director
Steve Jansen - The Occurrence of Slope,6.5,1,0,concert
