title,vote_average,vote_count,revenue,keywords
The Scorpion King 2: Rise of a Warrior,4.7,609,0,"magic, affectation, mercenary, training, greek, sword fight, revenge, battlefield, fictional war, desert, tyrant, warrior, action hero, sword and sorcery, supernatural power, amused, apathetic, derisive, disheartening, frustrated, gentle"
All the Presidents' Wives,1.0,2,0,"the white house, first lady"
Prince Among Slaves,6.0,1,0,"slavery, prince, woman director"
Four Christmases,5.817,1211,164112721,"holiday, romcom, relationship problems, dysfunctional family, family relationships, boyfriend girlfriend relationship, divorced parents, change of plan, christmas, relationship changes, christmas day, amused"
La vita nuova,7.0,1,0,"poetry, fate"
The Valkyrie Legacy,6.0,9,0,"world war ii, operation valkyrie"
Harold & Kumar Go to Amsterdam,6.5,31,0,"amsterdam, netherlands, cannabis, buddy, short film"
Hancock,6.351,9977,629400000,"love of one's life, flying, alcohol, advertising expert, superhero, pokies, forbidden love, lovers, invulnerability, affection, alcoholism, los angeles, california, duringcreditsstinger, desperate"
Carlitos and the Chance of a Lifetime,6.652,46,1537649,sports
It's Hard Being Loved by Jerks,6.8,9,0,"journalism, cartoon, trial, terrorism, political satire, jury trial, historical drama, investigative journalism, charlie hebdo, political documentary, tabloid journalism, politic terrorism, political cartoon, islamic terrorism"
Mesrine: Killer Instinct,7.309,971,15000000,"casino, france, based on novel or book, kidnapping, gangster, based on true story, montreal, canada, prison escape, murder, shootout, bank robbery, ex soldier, 1960s, algerian war (1954-62)"
Storm Cell,5.7,56,0,"tornado, hurricane, seattle, washington, storm chaser, date rape"
Hannah Montana & Miley Cyrus: Best of Both Worlds Concert,5.9,86,70642966,concert
Bedtime Stories,6.158,2910,212874864,"wishes come true, escapade, disorder, imaginary, miraculous event, imaginary kingdom, life turned upside down, nothing goes right"
Hellboy II: The Golden Army,6.765,5453,160388063,"rebellion, superhero, auction, northern ireland, based on comic, resignation, spear, superhero team, super villain, remorse, self exile, citizen action, war zone, robot fighting, father son conflict"
The Forbidden Kingdom,6.63,1838,127906624,"martial arts, based on novel or book, temple, legend, villainess, time travel, fistfight, shaolin, tempel, urination, east asian lead, staff, medieval, wuxia, warrior, action hero"
NYC: Tornado Terror,5.2,54,0,twister
Run for Your Life!,5.0,10,0,"heroin, junkie, ruhr, iron man gth"
"For a Moment, Freedom",5.773,11,0,"refugee, road movie"
The Librarian: The Curse of the Judas Chalice,6.264,512,0,"vampire, auction, new orleans, louisiana, mythology, treasure hunt, judas, psychotronic film, dracula"
Vicky Cristina Barcelona,6.793,3898,96409830,"barcelona, spain, photographer, artist, menage a trois, painter, author, summer, polyamory, bohemian, wonder, romantic"
Notes on an American Film Director at Work,5.6,5,0,"new york city, cinema on cinema, behind the scenes, filmmaking"
Heart of a Dragon,5.8,2,0,"based on true story, remake, great wall of china"
The Thirst: Blood War,3.143,7,0,vampire
Margaret Thatcher: The Long Walk to Finchley,6.8,8,0,"biography, british politics, 1950s, margaret thatcher, tory politician"
Fool's Gold,5.789,1541,111231041,"helicopter, gambling debt, gangster, obsession, cemetery, mentor, rapper, shipwreck, bahamas, jet ski, treasure hunt, rivalry, scuba diving, billionaire, underwater, anger, boating accident, ex-husband ex-wife relationship, henchmen, ship's crew, quest, beach bum, hidden treasure, divorced couple, treasure hunter, spanish history, spoiled, father daughter relationship, sea plane, missionary church, history and legacy, lighthearted, charming, frustration, still in love, spanish gold, ex friend, spanish galleon, romantic"
Long Flat Balls II,4.5,11,0,troops
Stargate: The Ark of Truth,7.14,543,8900000,"spacecraft, space travel, wormhole, alien, super power"
I've Loved You So Long,7.2,226,0,"prison, sibling relationship, release from prison, nightclub, nancy, doctor, visit, death, physician, campfire"
Ich will da sein - Jenny Gröllmann,0.0,0,0,"berlin, germany, german democratic republic, breast cancer"
A Tale of Legendary Libido,5.772,46,0,"legend, joseon dynasty (1392–1910)"
Futurama: The Beast with a Billion Backs,6.968,594,0,"saving the world, alien life-form, alien, creature"
Babylon A.D.,5.665,2192,72109200,"future, baby, smuggling (contraband), submarine, pregnancy, dystopia, prosecution, mercenary, protection, moral conflict, vision, cyberpunk, religious cult, sect, messiah, genetic alteration"
Detective Conan: Full Score of Fear,6.907,150,23760176,"detective, murder, anime"
The Last Lullaby,6.7,13,0,"hitman, shootout"
Once Upon a Time... The Umbrellas of Cherbourg,8.0,1,0,movie business
Return to Sleepaway Camp,5.8,330,0,"summer camp, barbed wire, forest, bully, murder, camp, slasher, paintball , psycho killer"
IMAX Dolphins and Whales: Tribes of the Ocean,6.5,11,7518876,"whale, dolphin, underwater, killer whale, manatee, conservation, nature documentary"
"The Good, the Bad, the Weird",7.176,771,0,"gunslinger, gun, asian western, korean, manchuria western"
War of the Worlds 2: The Next Wave,3.7,65,0,"dystopia, space war, space invasion, martian, alien invasion"
The Business End: Violence in Cinema,8.0,2,0,documentary short
Below the Earth's Surface,5.6,20,0,"stadium, ruhr, mining, football (soccer), cave in"
Mat Hoffman's Tribute to Evel Knievel,7.6,12,0,"stunt, bmx, aerial stunts"
The Pleasure of Being Robbed,5.5,38,0,thief
Step Brothers,6.556,3282,128100000,"becoming an adult, hostility, autonomy, childhood trauma, stepbrother, slacker, man child, buddy, aftercreditsstinger, duringcreditsstinger, absurd, hilarious, farcical, ridiculous"
Virus Undead,3.475,20,0,zombie
Cloverfield,6.703,7529,170764026,"quarantine, monster, chaos, skyscraper, supernatural, giant monster, alien, disaster, break-up, destruction, survival horror, kaiju, military, found footage, aftercreditsstinger, hopeless, desperate, ominous, pessimistic, pov"
Tower of Druaga: The Aegis of Uruk - Jil's Adventure,0.0,0,0,short film
Max Embarrassment,6.5,11,1694896,"school friend, high school, parent child relationship, parody"
Tropic Thunder: Rain of Madness,6.8,57,0,"parody, mockumentary, behind the scenes, making of"
To Love and Die,5.722,9,0,"assassin, dating, young woman, thirty something, estranged father, contract killer, abandonment issues"
The Wedding Guest,8.0,2,0,"short film, animatic"
Yes Man,6.683,7165,223200000,"california, bungee-jump, falling in love, ex-wife, hollywood bowl, excuse, opposites attract, loan officer, scooter, duringcreditsstinger, life changing, inspirational, best friends, unlikely romance, amused, cheerful, joyful"
Ian Fleming: The Secret Road to Paradise,0.0,0,0,movie business
Sorry if I Love You,5.958,719,0,"age difference, girlfriend, man woman relationship, love, relationship, boyfriend"
Robot Chicken: Star Wars Episode II,7.5,147,0,based on tv series
Pokémon: Giratina and the Sky Warrior,6.756,266,47511422,"pocket monsters, battle, based on video game, interdimensional beings, anime"
Questa notte è ancora nostra,5.5,105,0,"romcom, interracial romance, cultural difference, rock band, band singer, chinese restaurant, funeral parlor, asian woman, chinese immigrant, vocal talent, struggling musician"
Lost City Raiders,4.6,71,0,"vatican (holy see), flooding, global warming, distant future, sunken treasure"
Turn the River,5.3,37,0,pool billiards
3-Day Weekend,4.1,20,0,"male friendship, lgbt, mountain cabin, hookup, long term relationship, weekend getaway, gay theme"
Katia's Sister,6.5,6,0,woman director
Ghost Town,6.531,1025,27100000,"dying and death, adultery, new york city, egypt, life and death, winter, widow, bus, museum, surgeon, anti-social, lawyer, hospital, spirit, patient, doorman, dentist, exhibition, dead man, lecture, great dane, anthropologist, talking to the dead, manhattan, new york city, death of husband, dramedy, mummified bodies, unresolved issues, bar, unlikely romance, misanthrope, self-centered, human rights lawyer"
Die Entdeckung der Currywurst,3.583,6,0,woman director
Das Wunder von Berlin,5.375,12,0,"border, east berlin, west berlin, east germany"
Boot Camp,5.9,202,0,"reality spoof, boot camp"
"Thou Shalt Not: Sex, Sin and Censorship in Pre-Code Hollywood",6.067,15,0,"hays code, movie business, hollywood, pre-code, censorship"
De feu et de glace,5.906,32,0,"ice skating, ice skater"
Allan Quatermain and the Temple of Skulls,3.4,35,0,"rescue, south africa, treasure hunt, allan quatermain"
The Art of War II: Betrayal,4.743,109,0,"martial arts, corruption, revenge, betrayal, action hero"
Such Hawks Such Hounds,7.7,8,0,woman director
The Sky Crawlers,6.74,167,0,"peace, meat pie, adult animation, child smoking, alternative reality, aftercreditsstinger"
Ian Fleming's Incredible Creation,0.0,0,0,movie business
Bam Margera Presents: Where The #$&% Is Santa?,5.278,18,0,"santa claus, stunt, north pole"
Kill Switch,4.521,118,0,serial killer
Dance of the Dead,5.8,212,0,"high school, dance, cemetery, loser, zombie"
Emma Smith: My Story,5.3,5,881787,"husband wife relationship, faith, prophet, latter day saints, 19th century, mormonism, nauvoo illinois"
The Man Who Came Back,4.353,17,0,"prison escape, perjury, discrimination, post civil war"
Trip to Asia: The Quest for Harmony,10.0,1,0,"berlin, germany, concert, shanghai, china, asia, orchestra, travel, hong kong"
Summer Hours,6.382,170,7499424,"sibling relationship, summer, family"
27 Dresses,6.448,3296,160300000,"newspaper, new love, lovesickness, sibling relationship, wedding planner, witness, bride, bridesmaid, romcom, sister, sibling rivalry, reporter, wedding, woman director, hilarious, cheerful, familiar"
Chocolate,7.329,537,0,"autism, yakuza, thailand, gang, debt, female martial artist, martial arts school, sick mother, mob"
Star Wars: The Clone Wars,6.144,2137,68282844,"android, separatists"
A Love Story of Today,0.0,0,0,"making of, short film"
Birdsong,7.1,21,24498,"three kings, catalonia, spain, religion, journey, three wise men"
102 Minutes That Changed America,7.5,63,0,"new york city, video surveillance, terrorism, cell phone, 9/11, surveillance footage, real time"
Rest Stop: Don't Look Back,5.505,103,0,"gas station, kidnapping, serial killer"
A Better Man: The Making of 'Tootsie',6.0,3,0,movie business
Alone in the Dark 2,3.569,106,0,based on video game
The Other Boleyn Girl,6.694,2169,78269970,"sibling relationship, based on novel or book, england, kingdom, politics, queen, royalty, religion, mistress, historical fiction, king, period drama, royal court, anne boleyn, henry viii, palace intrigue, 16th century, aristocrats, scathing"
Gonzo: The Life and Work of Dr. Hunter S. Thompson,6.9,126,0,"biography, celebrity, wealth, election, anger"
Sex and the City,6.571,2210,418800000,"hotel, new year's eve, new york city, forgiveness, city portrait, fashion journal, saint louis, female friendship, romcom, fashion designer, malibu, loss of libido, botox, couples therapy, best friend, wedding, break-up, fashion, manhattan, new york city, desire to have children, female sexuality"
Popcorn and Jellybeans: Making a Thanksgiving Classic,0.0,0,0,movie business
Secrets of State,5.8,114,0,"intelligence agency, terrorism"
Grand Canyon Adventure: River at Risk,5.5,19,0,"grand canyon, rafting, scientific expedition, water planet, nature documentary, expert opinion, water crisis, observational documentary, colorado river, water cycle, documentary film, water conservation, nature and conservation"
The Ballad of Betty & Joe,0.0,0,0,"musician, silent film, busker, music film, busking, short film"
Mitzi Gaynor: Razzle Dazzle! The Special Years,0.0,0,0,"music documentary, tv special"
Fifty Dead Men Walking,6.323,164,0,"ira (irish republican army), slot machine, riot police, woman director"
A Muppets Christmas: Letters to Santa,6.0,69,0,"holiday, puppetry, christmas, anthropomorphic puppets, christmas special"
Finding Amanda,4.8,45,0,"gambling, pimp, rehabilitation, uncle, television producer, prostitution, niece, las vegas, uncle niece relationship"
Sinterklaas: The Secret Of The Big Book,7.5,2,0,"holiday, sinterklaas"
The Red Green Story: We're All in This Together,5.1,4,0,sketch comedy
The Dream is Always the Same: The Story of Risky Business,5.5,2,0,documentary short
Pulse 3,4.5,73,0,"suicide, video game, scissors, full moon, train crash, nuclear explosion"
Hamlet 2,5.886,188,4886216,"high school, music teacher, musical, satire, teacher, politically incorrect, irreverence, sweat"
Charlie Bartlett,6.675,673,5254986,"depression, high school, new love, school performance, suicide attempt, cleverness, drug addiction, private school, medicine, girlfriend, toilet, advice, teenage crush, psychiatrist, school bus"
The Prince & Me: A Royal Honeymoon,5.6,132,0,"queen, honeymoon, prince, vacation, europe, sequel, royalty, woman director, ski"
Dr. Dolittle: Tail to the Chief,5.3,192,0,animals
Jaane Tu... Ya Jaane Na,6.782,163,11100000,"romantic, familiar"
All My Friends Are Leaving Brisbane,7.3,3,0,"australia, friendship, romance, growing up"
Turning of the Tide: The Ill-Starred Making of Moontide,0.0,0,0,documentary short
Pray the Devil Back to Hell,7.231,13,0,"strong woman, peace, woman director, liberia"
Transporter 3,6.158,3543,109000000,"martial arts, police, killing, detective, love, police chase, gunfight, getaway driver, taken, action hero"
Little Spirit: Christmas in New York,2.0,2,0,"department store, cab driver, christmas, missing dog"
The Necessities of Life,7.4,13,0,"sanatorium, inuit, tuberculosis, sickness"
Walking with Pasolini,0.0,0,0,pasolini
Polvo nuestro que estas en los cielos,5.7,3,0,woman director
Tokyo Sonata,7.4,263,892714,"piano lessons, middle class, family relationships, tokyo, japan, loss of job, losing a job"
"Paris, Not France",0.0,0,0,woman director
SOS: Summer of Suspense,5.0,5,1840042,"friendship, drug trafficking, lighthouse, interpol, summer vacation, sea lion, cpr, children in danger"
Empire State Building Murders,0.0,0,0,semi-documentary
The Black Balloon,6.372,94,5000000,"sydney, australia, birthday, autism, family dinner, swimming, first love, social services, woman director"
No Man's Land: The Rise of Reeker,4.8,78,0,"sheriff, robber, gore, flashback, burned alive, serial killer, grim reaper, desert, held at gunpoint, death, taser, hit by a car, exploding gasoline station"
Mirrors,6.284,1961,72400000,"schizophrenia, subway, night watchman, possession, hallucination, morgue, alcoholism, ex-cop, remake, rural area, medication, demon, psychiatrist, estranged wife, nypd, evil, newspaper clipping, curious, hostile, urban gothic, anxious, ambiguous, antagonistic, approving, audacious, ghoulish, gloomy, horrified"
A Very Merry Daughter of the Bride,5.7,19,0,"woman director, christmas"
Meerkat Manor: The Story Begins,6.6,7,0,"wildlife, meerkat, animals, nature"
Sonic: Night of the Werehog,6.859,47,0,"camera, werewolf, based on video game, ghost, tie-in, hedgehog, haunted mansion"
Foreign Exchange,4.4,35,0,"high school, ohio, masturbation, exchange student, sex comedy, senior high school students"
Der Mann im Keller,0.0,0,0,"berlin, germany, chain, obsession, insanity, eroticism, externally controlled action, cellar, manipulation, seduction, razor, beauty, bribery"
Rise from Your Grave,0.0,0,0,"voodoo, zombie, tongue in cheek, fictional government agency, tech noir, no budget, meteor crash"
George Carlin: It's Bad for Ya!,7.865,133,0,stand-up comedy
The View from Greenhaven,4.2,3,0,"ferry boat, train accident, family relationships, motorcycle, coastal town, gratitude, train trip, marital crisis, mystery destination"
The Bank Job,6.836,2486,64828421,"london, england, blackmail, 1970s, vault, car dealer, bahamas, based on true story, london underground, strip club, extortion, police corruption, double cross, railway station, political corruption, bank heist, cabinet officer, the big score"
The Deaths of Ian Stone,5.614,285,10000,"grave, ice hockey, parallel world"
Dr. Jekyll and Mr. Hyde,4.6,37,0,"mad scientist, alter ego, mad doctor, jekyll and hyde, psychotic, somber, unassuming, provocative, ambiguous, ambivalent, antagonistic, audacious, derisive"
Terra Incognita: Making the Andromeda Strain,2.5,1,0,making of
Love Fight,6.8,4,0,sports
Heartless Disappearance Into Labrador Seas,0.0,0,0,"sea, mother, canada, marriage proposal, husband wife relationship, wedding vows, photographer, ocean, photography, poem, poetry, married couple, artist, marriage, father, newfoundland and labrador, romance, love, wedding, wedding dress, parents, husband, long distance relationship, water, partying, party, newfoundland, newfoundland women, east coast, joyous, yates, labrador"
"On the Other Hand, Death: A Donald Strachey Mystery",5.438,24,0,"based on novel or book, undercover, homophobia, detective, harassment, vandalism, teacher, lesbian relationship, murder, private investigator, murder investigation, gay theme, gay couple"
The Last Day of Summer,6.196,23,0,"skateboarding, season, camping, wish, talent show, bully, time loop, summer, buddy"
Dear Zachary: A Letter to a Son About His Father,8.032,560,0,"husband wife relationship, parent child relationship, grandparent grandchild relationship, loss of loved one, pregnancy, narration, murder, break-up, psychiatrist, older woman younger man relationship, mourning, medical school, hopeful, tragic"
The Spiderwick Chronicles,6.676,2772,164200000,"sibling relationship, parent child relationship, elves, fairy, twin brother, family relationships, single mother, alternative reality, father daughter reunion, hidden truth, goblin, ogre, hidden room, magical creature, griffin, aging aunt, summoning spell, brother sister relationship, magic book, based on young adult novel, abandoned child, fairies, impending divorce, identical twins"
Cinematic Titanic: Frankenstein's Castle of Freaks,7.8,4,0,parody
Flow: For Love of Water,6.595,21,0,"rebellion, crisis, survival, stealing, woman director, corporation, natural resources, privatization, citizen"
Martyrs,7.303,2897,1100000,"child abuse, suffering, nihilism, degradation, ecstasy, woman martyr, cult, hysteria, helplessness, revenge, torture chamber, mercilessness, torture, cruelty, home invasion, transcendence, decadence, martyr, angst, captivity, abuse, mistreatment, dehumanization, emaciation, new french extremism, incarceration, chloroform, mysticism, abused woman, depravation, blood on body, playful, murderess, lesbian, devastating, mental abuse, romantic"
Par suite d'un arrêt de travail...,2.7,5,0,road movie
Dying or Feeling Better,4.0,3,0,"twin sister, parents-in-law, coming of age, interracial relationship, interracial friendship, woman director"
Ip Man,7.759,3976,22100000,"martial arts, kung fu, sports, foreigner, bravery, rice, katana, market, tragic hero, second sino-japanese war (1937-45), racism, sadist, master, wing chun, bayonet, factual"
Che: Part Two,6.652,660,8638163,"hero, central intelligence agency (cia), cuba, biography, che guevara, bolivian army, la paz, bolivia"
The Rocker,6.046,611,8762890,"rock 'n' roll, 1970s, drums, groupie, heavy metal, headbanging"
Get Smart,6.202,3749,230685453,"dancing, mission, usa president, washington dc, usa, airplane, undercover agent, spy, sarcasm, bakery, los angeles, california, terrorism, secret service, government agent, weight loss, secret headquarters, world domination, moscow, russia, hand to hand combat, field agent, ineptitude, vice president, criminal organization, homeland security, spycraft, based on tv series, smolensk"
A Tram in SP,5.7,7,0,family
Fireflies in the Garden,6.2,225,6692182,"rap music, unpaid bill, windshield"
Johnny Cash at Folsom Prison,8.0,3,0,prison
K-20: The Fiend with Twenty Faces,6.0,44,21443265,woman director
El Viaje de la Nonna,5.8,5,0,"mexico, italy, travel"
Nacht vor Augen,3.75,4,0,"sibling relationship, forest, afghanistan war (2001-2021), woman director"
High School Musical 3: Senior Year,6.5,3554,252909177,"high school, musical, sequel, coming of age, high school student, duringcreditsstinger"
"Meine Mutter, mein Bruder und ich!",5.0,3,0,"armenia, integration"
Nothing But the Truth,6.944,521,409832,"prison, journalist, central intelligence agency (cia), assassination attempt, integrity"
Dolls and Angels,6.4,33,0,"relationship problems, suburb"
The Hidden Side of Persepolis,0.0,0,0,documentary short
Barefoot to Jerusalem,0.0,0,0,"jerusalem, devil, barefoot, the juniper tree, nietzchka keene, heroine of hell"
Engine Sentai Go-Onger Special DVD: It's a Seminar! Everyone GO-ON!!,0.0,0,0,"pollution, monster, superhero, giant monster, giant robot, superhero team, talking car"
Freiwild - Ein Würzburg-Krimi,8.0,1,0,"au pair, würzburg"
Hollywood Singing and Dancing: A Musical History,8.0,3,0,"dance performance, movie business, singer, hollywood, songwriting"
Three Kingdoms: Resurrection of the Dragon,6.2,129,0,warrior woman
Nora's Will,7.2,20,0,"coffin, pizza, photograph, woman director"
Hero Wanted,5.3,159,10,"robbery, child in peril, revenge, murder, hospital, stabbing, nonlinear timeline, bludgeoning, bank teller, getaway driver, bandanna, surrogate father, murder investigation"
The Secret Behind Escape,0.0,0,0,documentary
No se preocupe,0.0,0,0,"grandmother, production, short film, filming, old"
Black Power Salute,0.0,0,0,"vietnam war, olympic games, fbi, protest, black panther party, racism, human rights, political protest, desegregation, radical politics, athletics, olympic athlete, 1960s, sports politics, human rights protest, anti-blackness, civil rights movement, black power, cointel pro, boycott, san jose, california"
James Bond in the Bahamas,0.0,0,0,movie business
Of Time and the City,7.1,39,0,"england, pop culture, liverpool, england, wistful"
Batman Unmasked: The Psychology of The Dark Knight,7.4,51,0,"super power, special feature"
"Falco: Damn It, We're Still Alive!",6.0,33,0,"biography, falco"
The Inhabited Island,5.323,110,21834845,"spacecraft, sibling relationship, based on novel or book, sword fight, space, strugatsky, brainwashing, big city, girlfriend from china, hard to kill, testting, head of state"
The Informers,4.786,243,382174,"child murder, slice of life, hollywood, drugs, hedonism, 1980s, dysfunctional, intersecting lives"
The Chef's Letter,3.0,4,0,"lgbt, gay theme, short film"
You Must Remember This: The Warner Bros. Story,8.5,12,0,cinema history
Patsy Mink: Ahead of the Majority,0.0,0,0,"hawaii, u.s. congress, female politician, asian woman, chinese american, woman director, congresswoman"
Nightmare at the End of the Hall,4.972,18,0,"suicide, loss of loved one, reincarnation, teacher, preparatory school"
Horn of Plenty,5.0,12,0,"ritual, family relationships, money, inheritance"
Anne of Green Gables: A New Beginning,5.735,17,0,"self-discovery, widow"
Stranded: I've Come from a Plane That Crashed on the Mountains,8.2,29,0,"1970s, docudrama, struggle for survival, andes mountains, plane crash, crash survivor"
The Nightmare Before Christmas: The Original Poem,7.429,7,0,"poem, narration, santa claus, halloween, christmas, short film"
The Oxford Murders,6.0,683,0,"philosophy, mathematics, mathematician, symbolism, oxford, symbol, organ transplant, triangle, old woman murdered, oxford university, mass child killing, false alibi, enigma machine"
"10,000 BC",5.5,3083,269784201,"hunter, indigenous, fighter, female lover, pyramid, mammoth, sapient, mountain village, stone age, primitive time, prehistory, saber-toothed tiger, admiring"
Jodhaa Akbar,7.3,264,28700000,"husband wife relationship, marriage crisis, emperor, hindu, biography, sword fight, period drama, domineering mother, mughal empire, marriage of alliance, 16th century, love after marriage, hindu muslim conflict"
"Die, Cheerleader, Die",3.0,1,0,slasher
Massenet: Thaïs,0.0,0,0,"opera, opera live performance, the metropolitan opera"
The Making of 'Dance of the Dead',10.0,1,0,behind the scenes
Harlan: In the Shadow of Jew Süss,6.0,7,0,propaganda
Il coraggio di Angela,6.0,1,0,mafia
A Perfect Day,6.456,113,0,"obsession, ex husband, dysfunctional family, obsessive love, abusive husband"
La Pallastrike sull'Isola di Pasqua,6.2,15,0,cartoon
Lorna's Silence,6.8,156,4916592,"immigrant, fictitious marriage, gangster, taxi driver, junkie, belgium, conscience, albanian, social realism, fake marriage"
One Million Yen Girl,7.055,55,0,"coming of age, woman director"
Six Reasons Why,5.2,12,0,"sibling relationship, post-apocalyptic future"
Ringo Starr: Off the Record,0.0,0,0,beatlemania
The Tale of Despereaux,6.135,979,87000000,"based on novel or book, forgiveness, loyalty, totalitarian regime, mouse, villain, honor, unlikely friendship, chivalry, animal lead, fantasy"
Burn After Reading,6.666,5024,163700000,"washington dc, usa, blackmail, paranoia, black humor, plastic surgery, autobiography, memory, corpse, divorce, gym, disc, ex priest, fitness, online dating, memoirs, personal trainer, shaggy dog story"
Foster's Home for Imaginary Friends: Destination Imagination,7.0,13,0,"villain, imaginary friend, rabbit, human"
Anything for Her,6.957,289,0,"prison, france, airport, escape, police, judge, chase, investigation, murder, shootout, hospital, parents, husband, innocent"
Unstable Fables: 3 Pigs and a Baby,5.8,64,0,"wolf, pig, based on fairy tale"
Three and Out,5.5,39,607324,"friendship, independent film"
Under a Red Moon,0.0,0,0,"burglary, drug overdose, nosy neighbor, broken family, dead son, loss and grief"
Dante 01,4.9,131,0,"prison, space suit, space, space centre"
Righteous Kill,5.879,1306,79498846,"revenge, murder, dirty cop, depressed"
