title,vote_average,vote_count,revenue,keywords
Whitney Houston: I Wanna Dance with Somebody,7.013,498,59800000,"musician, drug addiction, biography, rhythm and blues (r&b), singer, pop music, lgbt, burlesque, domineering, spousal abuse, soul music, exhilarated"
The Passenger,5.8,72,0,"bullfighting, spain, sword, slime, alien life-form, road trip, alien, decapitation, parasite, mother daughter relationship, rural, alien spaceship, trip"
Better Nate Than Ever,6.417,102,0,"based on novel or book, musical, lgbt, broadway musical, musical theater, gay theme"
Miles from Nowhere,2.75,4,0,"terminal illness, dying man, lgbt, retreat, chemotherapy, terminal cancer, brother sister relationship, gay theme, gay couple"
Kurz nach Schalling unterm Berg,0.0,0,0,"vampire, austria, mysterious woman, rural"
It's What She Would Have Wanted,0.0,0,0,"funeral, dark comedy, wake, playful, short film"
Three Robbers and a Lion,6.6,19,4061822,"lion, talent show, based on children's book, tram, talking animal, gang of robbers"
Close,7.786,929,3129968,"friendship, suicide, forgiveness, male friendship, melancholy, bullying, ice hockey, coming of age, grief, best friend, teenage boy, bike, guilt, childhood, lgbt, childhood friends, peer pressure, masculinity, intimacy, death of best friend, grim, field trip, boyhood, vulnerability, oboe, complex, sad, boys' love (bl), depressing"
Scorpio Nights 3,5.735,17,0,"sequel, lust"
Bones and All,7.0,1532,15234907,"based on novel or book, sense of guilt, homelessness, addiction, road trip, love, interracial romance, teenage girl, family abandonment, cannibal, guilt, sensuality, first love, pickup truck, flesh eating, road movie, genre bending, dark secret, 1980s, american midwest, abandonment, romantic thriller, estranged mother, brother sister relationship, love story, body horror, intimate, suspenseful, sentimental, romantic, brutal violence"
Call it the burning,10.0,1,0,"immigration, arts, grief, theatre"
A Brush with Christmas,5.581,68,0,christmas
Missing Home,8.0,18,8021873,"family relationships, family, batak, emotional and touching"
The Stories of West Side Story,7.8,9,0,"musical, broadway, broadway musical, stage adaptation, musical adaptation"
"Wuthering Heights: Love, Hate and Vengeance",8.0,2,0,"literature, literature creation, victorian era, documentary, literature history, art documentary, emily bronte"
The Ghosts of Monday,5.15,30,0,"ghost, haunted hotel"
Garden of Remembrance,6.8,5,0,"anime, short film"
Nel nostro cielo un rombo di tuono,7.8,13,0,"champion, football (soccer), football (soccer) player"
Costa Concordia: Chronicle of a Disaster,7.2,9,0,"boat accident, cruise ship, rescue from drowning, sinking boat, sinking ship, incident, rescue at sea"
Caravaggio's Shadow,6.448,144,0,"italy, artist, artists' life, painter, art, 17th century, caravaggio, paintings"
Project Gemini,5.727,477,211674,"space, alien planet, universe, alien creature, spaceship, science fiction"
Furies,6.9,69,0,"ngô thanh vân, tóc tiên, rima thanh vy, đồng ánh quỳnh"
Wild Beauty: Mustang Spirit of the West,6.0,2,0,"climate change, horse, animal rights, environmental, wild horse, female journalist, western usa, environmental conservation, environmental destruction, government corruption, portrait of a filmmaker"
Cherry Magic! THE MOVIE,7.7,31,0,"virgin, office, supernatural, workplace, romance, based on manga, co-workers relationship, lgbt, office romance, workplace romance, honest, gay romance, gay theme, boys' love (bl), life, salaryman"
camrip,10.0,1,0,"torrent, camrip"
All My Friends Hate Me,5.919,149,78361,"birthday, paranoia, reunion, surprise party, practical joke, college reunion, friend, birthday prank"
Lullaby,7.2,117,0,"basque country, spain, family relationships, motherhood, childbirth"
Deep in the Heart: A Texas Wildlife Story,8.8,6,0,"wilderness, wildlife"
Crimes of the Future,6.028,1214,4551565,"human evolution, detective, dystopia, murder, performance art, transhumanism, evolution, surgery, shipyard, body horror, organ trafficking, biotech company"
Bill Burr Presents: Friends Who Kill,5.461,77,0,"stand-up comedy, stand-up comedian"
The Unbearable Weight of Massive Talent,6.788,2312,29116320,"central intelligence agency (cia), undercover, screenplay, satire, birthday party, drug lord, struggling actor, father daughter relationship, ilha, ambiguous, cheerful, euphoric, cinema, traficante"
Facing Nolan,7.4,22,405797,"sports, baseball, texas, biography, baseball player, sports documentary, baseball pitcher, houston astrodome, major league baseball (mlb), rancher, texas rangers, houston astros"
Conjuring The Genie 2,5.0,1,0,"supernatural, novelist, genie"
Grace Kelly – Hollywoods tragische Prinzessin,0.0,0,0,movie star
Currentzis conducts Beethoven Symphony No. 9,10.0,1,0,"composer, classical music, pianist, ludwig van beethoven, classical concert, german"
Dans les pas de Jean-Paul Rappeneau,6.0,1,0,biography
Corrective Measures,4.995,101,34489,"based on comic, lockdown, prison measures"
The Guardians of the Galaxy Holiday Special,7.101,2238,0,"holiday, superhero, celebrity, saving christmas, talking dog, based on movie, aftercreditsstinger, marvel cinematic universe (mcu), christmas, christmas special, short film, holiday special, space dog"
Fullmetal Alchemist: The Revenge of Scar,6.5,237,0,"fight, sequel, revenge, scar, genocide, alchemy, military, genocide survivor, soldiers, brothers"
The Most Colorful Time of the Year,5.7,23,0,christmas
All I Didn't Want for Christmas,6.4,9,0,"christmas, christmas theme"
The Estate,5.373,122,572062,"dark comedy, aunt niece relationship, moral conflict, terminal illness, inheritance, family, will, family conflict, inheritance fight, con, dying woman, cousin relationship, family estate, competitive, miserable, comedy of errors, cantankerous, cafe owner, estranged aunt, dying aunt, contentious relationship"
8 Years,4.5,6,0,"relationship problems, male homosexuality, relationship, lgbt, gay theme, gay relationship"
"Grindland – Red, Monk and the Birth of DIY",0.0,0,0,"skateboarding, biography, skate park, skater, memorial, concrete"
The Legend of the Galactic Heroes: Die Neue These Collision 1,8.8,6,0,"based on novel or book, space war, remake, military, anime"
"Strong Fathers, Strong Daughters",5.5,12,0,"based on novel or book, religious film"
The In Between,7.336,815,0,"afterlife, communicating with the dead"
Look Both Ways,6.871,703,0,"texas, graduation, romcom, parallel lives, dramedy, pregnancy test"
One Piece Film Red,7.2,1093,171315305,"pirate, fighting, super power, aftercreditsstinger, shounen, anime, idol, adventure, non-canon"
La Misionera de San José,0.0,0,0,"religion, catholicism"
Miracle in Cell No. 7,7.9,15,0,"prison, prison cell, remake, jail, dramedy, kid"
Parece que va a nevar,0.0,0,0,"friendship, small town, mexico, sadness, deserted town, friends, old man, death, ghost town, bonding, short film"
Serve the People,6.4,45,547758,korean army
Nope,6.828,4624,170823080,"california, horse, exploitation, video surveillance, death of father, alien, ufo, social commentary, alien invasion, child star, chimpanzee, alien contact, aftercreditsstinger, horse farm, african american man, racial issues, brother sister relationship, pathetic, psychological horror, sci-fi horror"
Show Business Is My Life (But I Can't Prove It),6.0,1,0,gary mule deer
Hanukkah on Rye,6.238,21,0,hanukkah
Curse of Crom: The Legend of Halloween,5.5,29,0,"mission, monster, halloween, ancient curse, teenage protagonist, teenage"
Chip 'n Dale: Rescue Rangers,7.0,1318,623190,"cartoon, los angeles, california, former best friend, missing person, duringcreditsstinger, live action and animation, bootleg, corrupt cop"
A Cloud Never Dies,0.0,0,0,"vietnam, buddhism, buddhist monk, buddhist, biography, zen, vietnamese refugees, buddhist monastery"
You Will Not Have My Hate,5.907,43,0,"based on novel or book, based on true story, grief, terrorism, massacre, hatred, terrorist attack, fatherhood, facebook, mass shooting, father son relationship, death of a loved one, viral, islamic terrorism, terrorist, open letter"
Winona Ryder: The Ghosts She Called,7.654,13,0,"madcap comedy, buddy comedy"
Lonely Castle in the Mirror,7.11,92,0,"based on novel or book, survival, seinen, nervous, anime, dramatic, excited, powerful"
Jerry & Marge Go Large,7.373,421,0,"small town, michigan, mathematics, massachusetts, harvard university, lottery, based on true story, winning lottery, based on magazine, newspaper or article"
Chocolate City 3: Live Tour,5.5,4,0,"male stripper, gay interest"
Clint Eastwood: The Last Legend,7.289,19,0,"biography, historical figure, hollywood star, film director, usa cinema, documentary, best directing, hommage to eastwood, creative director"
Snoopy Presents: Lucy's School,7.139,36,0,"friendship, teacher, school, overcoming fears, short film, tv special, student, fear of change"
The Snowball Effect,4.7,6,0,christmas
Das Wunder von Kapstadt,6.9,4,0,"based on true story, heart transplant"
Honor Society,7.4,413,0,"high school, scholarship, harvard university, manipulation, nerd, college, coming of age, breaking the fourth wall, teen movie, school play, lgbt teen, overachiever, teachers and students, academia, grooming, popular girl, romantic rival, relationships, top college rivals, rivals to lovers, academic, teenager, student threatens teacher"
Falling for Christmas,6.231,847,0,"holiday, christmas spirit"
Christmas on Mistletoe Lake,6.577,13,0,christmas
Mirreyes contra Godínez 2: El retiro,7.513,113,0,sequel
Elvis,7.478,3726,288670284,"rock 'n' roll, biography, singer, music business, rock singer, 1950s, famous song, apathetic, disdainful, biographical, biopic"
Dua Lipa: Elevating,5.25,4,0,"england, pop star, albania, model, pop music, united kingdom, fans, music"
The Sound of 007,7.1,51,0,music documentary
The Good Witch of Christmas,5.571,7,0,santa claus
Two Much for the Job,5.0,60,0,"education, cultural difference, school"
Sweet as Pie,6.3,26,0,"apple, apple tree, picking apples, orchard, apple picking"
Good Boy,6.347,330,0,dog
The True Story of Pirates,7.9,15,0,"excavation, madagascar, pirate, historical, archaeologist, archaeological dig, archaeological expedition, mauritius, indian ocean, ship wreck, ship wrecked, underwater archaeology, research scientist, history and legacy, documentary, underwater cemetery, research group, archaeology, sea pirates, historical documentary"
Broker,7.181,512,18632208,"baby, adoption, investigation, broker, road trip, family relationships, road movie, abandoned baby, busan, south korea, baby box"
Ranveer vs Wild with Bear Grylls,5.4,10,0,"wilderness, adventurer, interactive"
Pinocchio,6.3,1688,0,"fairy, musical, puppet, live action and animation, live action remake, talking animal"
Aisle Be Home for Christmas,5.8,4,0,christmas
Jew Suess 2.0,2.0,1,0,"antisemitism, social documentary, online lying, social decay, online harassment, historical documentary"
"BENE! Vita di Carmelo, la macchina attoriale",6.75,2,0,"documentary, art documentary"
Crayon Shin-chan the Movie: The Tornado Legend of Ninja Mononoke,7.2,14,20617005,"ninja, anime"
TÁR,7.1,1433,29048571,"infidelity, new york city, berlin, germany, composer, musician, classical music, conductor, orchestra, philippines, lgbt, character study, adopted child, concert pianist, fictional biography, angry, metoo, cautionary, cancel culture, intense"
Gold,6.2,631,176048,"paranoia, survival"
The Royal Treatment,6.659,789,0,"royalty, romantic cinema"
The Fabelmans,7.6,2605,45629909,"high school, husband wife relationship, arizona, bullying, family relationships, coming of age, antisemitism, teenage boy, filmmaking, childhood, semi autobiographical, marital problem, big dreams, father son relationship, mother son relationship, introspective, adoring, comforting, compassionate, empathetic, sympathetic, young filmmaker"
Amsterdam,6.063,1725,31245810,"investigation, based on true story, conspiracy, duringcreditsstinger, framed for murder, 1930s"
Remains of a Man,4.2,5,0,audacious
The Surgeon of the Rusty Knife,7.3,26,0,"affectation, admiring, adoring, enthusiastic"
"Ordinary Men: The ""Forgotten Holocaust""",7.39,41,0,"mass murder, holocaust (shoah), world war ii, jew persecution, mass shooting, european history, death squads, german history"
The Shadow of the Day,6.415,112,0,"racial segregation, antisemitism, impossible love, italian fascism"
Charles Burnett : Le rebelle silencieux de Watts,0.0,0,0,black independent movement
Soy tu fan: La película,7.8,42,0,"ex-boyfriend, gathering, sequel, wedding, group of friends, rekindle, tropical storm, beach wedding"
Brahmāstra Part One: Shiva,6.348,188,0,"superhero, mythology, astraverse"
Christmas Bedtime Stories,5.8,22,0,"holiday, christmas"
Plebs: Soldiers of Rome,6.105,19,0,"roman empire, ancient rome, soldier, slave, roman army, anachronistic, 1st century bc"
Cheaper by the Dozen,6.375,259,0,"based on novel or book, big family, remake, large family"
Nostalghia - Sui luoghi di Tarkovskij 40 anni dopo,7.0,1,0,cinema on cinema
Rabble Rousers: Frances Goldin and the Fight for Cooper Square,10.0,1,0,"gentrification, urbanism"
My Grown-Up Christmas List,7.3,24,0,"holiday, christmas"
The Lucy Mission: Origins of the Solar System,8.0,1,0,"asteroid, nasa, scientific study, space mission, solar system, space research, space exploration, skills challenge, life origin, origins of life, scientific research, spaceflight, observational documentary, space probe, documentary, teamwork, challenges"
Three Minutes: A Lengthening,7.2,6,71615,"holocaust (shoah), world war ii"
It's Christmas Again,3.3,3,0,"shepherd, skateboarding, religious education, bethlehem, musical, church service, christmas"
Marie-Soleil et Jean-Claude: au-delà des étoiles,0.0,0,0,tribute
The Cultural History of Museums,4.0,1,0,"art history, art museum, science and technology, architecture history, european history, technological evolution, natural history museum, european art"
Blood Relatives,4.7,19,0,"vampire, road trip"
Barbarian,6.843,2993,45400000,"monster, sexual abuse, paranoia, flashback, basement, serial killer, duringcreditsstinger, paranoid, airbnb, abduction, metoo, secret room, ghoulish"
New Gods: Yang Jian,7.453,86,70826303,"god, 3d animation, chinese mythology, donghua"
A Magical Christmas Village,6.333,27,0,"holiday, christmas"
The Real Derry: Jamie-Lee O'Donnell,0.0,0,0,northern ireland
100% USDA Certified Organic Homemade Tofu,9.0,1,0,"restaurant, spice, asian woman, tofu, mother daughter relationship, asian, social media influencer, viral, transgender, asian cinema, boobs, influencers, virality, transgender woman, influencer, breast augmentation, boob job"
