title,vote_average,vote_count,revenue,keywords
The Man Who Shook the Hand of Vicente Fernandez,4.9,11,0,"regret, celebrity, stroke"
Stanley Kubrick in Focus,6.0,5,0,influence
Nazis at the Center of the Earth,3.119,97,0,"nazi, cyborg, zombie, нацисти, зомбі"
Here Comes the Devil,5.453,137,4534,"demonic possession, tijuana"
Cloud Atlas,6.889,7329,130482868,"future, artificial intelligence (a.i.), based on novel or book, san francisco, california, clone, dystopia, lgbt, multiple storylines, duringcreditsstinger, century, 1930s, awestruck"
Helter Skelter,6.7,158,0,"japan, psychological stress, beauty, stress, based on manga, woman director, beauty queen, fashion model, top star"
Barbie in A Mermaid Tale 2,7.0,467,0,"princess, surfer, beach, magic, mermaid, based on toy, female protagonist, magical creature, talking fish, female surfer, 3d animation"
"Caracas, las 2 caras de la vida",5.0,2,0,"venezuela, hood, poverty"
Life of Pi,7.405,13506,609016565,"sea, faith, loss of loved one, 1970s, zebra, survival, young boy, zookeeper, orangutan, teenage boy, hyena, meerkat, magic realism, cargo ship, lifeboat, injured animal, storm at sea, told in flashback, wreckage, loss of family, teenage protagonist, family loss, flying fish, exhilarated, vibrant, teen fantasy"
The Revenge of the Siren,5.5,28,0,wanderhure
The Mark,3.619,21,0,christian film
"The Peter Weyland Files: Quiet Eye, Elizabeth Shaw",7.7,3,0,"prometheus, short film, science fiction"
Tom and Jerry: Robin Hood and His Merry Mouse,6.5,77,0,"cartoon, villain, robin hood, parody, anthropomorphism, sword fight, animals, archery"
Diary of a Wimpy Kid: Dog Days,6.34,1028,76196538,"best friend, summer, based on children's book, sweet sixteen, duringcreditsstinger, pool party"
After,5.53,183,0,"coma, crash, accepting death"
Tony Curtis: Driven to Stardom,7.0,7,0,"hollywood star, star showcase, life and career, biographical, biographical documentary, sex symbol"
All's Well That Ends Well - Live at Shakespeare's Globe,7.2,4,0,based on play or musical
Les Misérables,7.314,5460,442636309,"rebellion, army, robbery, france, based on novel or book, love triangle, love at first sight, brothel, mayor, french revolution, musical, arrest, based on play or musical, barricade, wedding, prostitution, falling in love, corpse, parole, convict, forced prostitution, police inspector, girl disguised as boy, historical drama, 19th century, out of wedlock child, historical romance, death of a child, abusive family, corrupt businessman, indifferent"
A Turtle's Tale 2: Sammy's Escape from Paradise,5.8,215,0,"escape, anthropomorphism, underwater, sea creature"
American Reunion,6.302,4577,234989584,"husband wife relationship, sequel, family reunion, masturbation, scat, high school reunion, nostalgic, quitting a job, milf, duringcreditsstinger, amused"
"Eine wen iig, dr Dällebach Kari",7.1,8,0,swiss
The Cold Light of Day,5.373,964,16863583,"government, espionage, kidnapping"
Say It Ain't Solo,2.0,1,0,"remake, hollywood"
What She Wants for Christmas,2.0,1,0,christmas
Losing Control,4.667,12,0,"harvard university, woman director, prevent male conception, phd thesis"
Poor Us: An Animated History of Poverty,8.0,2,0,"poverty, economics, inequality, poor, wealth differences"
The Central Park Five,7.0,118,273747,"prison, police, rapist, wrongful arrest, serial rapist"
The Thieves,6.7,313,83519699,"heist, hong kong, safecracker, diamond theft, criminal gang, macau"
2-Headed Shark Attack,4.278,297,0,"monster, animal attack, shark, creature feature, students"
The Last Will and Testament of Rosalind Leigh,5.039,115,0,"cult, wealth, inheritance, death, spooky house, antiques"
Rurouni Kenshin Part I: Origins,7.528,869,61700000,"japan, assassin, samurai, based on manga, jidaigeki, shinsengumi, 19th century, meiji period, bakumatsu, ishin shishi"
My Straight Son,7.678,143,0,"venezuela, gay parent, lgbt, hate crime, father son reconciliation"
"Farewell, My Queen",5.9,319,5297232,"marie antoinette, versailles, lgbt, 18th century, reader, french court, lady in waiting, identity swap, embroidery, fashion design, austrian, louis xvi, large jewel, dead rat, green dress"
The Dog Who Saved the Holidays,4.6,17,0,talking dog
Pitch Perfect,7.274,6748,115647426,"competition, roommates, college, female friendship, misfit, hazing, university, audition, group of friends, dorm room, bickering, dj, singing competition, film score, young adult, acapella, playful"
Girl Most Likely,5.6,265,1378426,woman director
Monster High: Escape from Skull Shores,7.7,112,0,"island, holiday, spring break"
The Tower,7.0,305,36531605,"helicopter, fire, panic, christmas party, survival, disaster, explosion, tower, firefighter, christmas, christmas eve, south korea, seoul, south korea"
Measuring the World,6.462,143,0,"based on novel or book, mathematician, biography, scientist, explorer, naturalist, 19th century"
Questa non è una esercitazione,7.0,2,0,"punk rock, alternative, industrial music, disciplinatha"
Justice League: Doom,7.413,911,0,"based on comic, super power, superhero team, woman director, loss of confidence"
Everybody Has a Plan,4.6,34,0,"husband wife relationship, river, adoption, buenos aires, argentina, twin brother, argentina, woman director, lung cancer, brother brother relationship"
A World for Raúl,4.571,7,0,short film
Free Angela and All Political Prisoners,7.1,27,0,woman director
The Healing,6.8,6,2465876,"philippines, broken glass, faith healer"
London 2012 Olympic Opening Ceremony: Isles of Wonder,7.753,75,0,"london, england, olympic games, ceremony, opening ceremony"
Detective Conan: The Eleventh Striker,6.862,138,44369456,"football (soccer), anime, suspense"
Student Of The Year,5.8,182,13749809,"friendship, jealousy, love triangle, competition, college, scavenger hunt, romance, reunion, triathlon"
A Werewolf Boy,7.637,278,0,"single parent, feral child, werewolf, orphan"
"Madrid, 1987",6.4,68,0,"journalist, madrid, spain, older man younger woman relationship, 1980s, age-gap relationship"
Project X,6.888,6626,102731865,"high school, birthday, birthday party, house party, teen movie, high school student, fake documentary"
Marvel One-Shot: Item 47,6.424,580,0,"superhero, secret agent, based on comic, marvel cinematic universe (mcu), short film"
The Grey,6.571,4000,79781695,"wolf, flashback, alaska, airplane crash, struggle for survival, based on short story, campfire, male camaraderie, oil rig , aftercreditsstinger, wolf pack, american wilderness, aggressive, grieving man, outdoors, wolf hunter"
Circle Jerks: My Career as a Jerk,0.0,0,0,"punk rock, hardcore punk"
Robot Mom,3.5,4,0,twins
Contraband,6.335,2145,96262212,"smuggling (contraband), head wound, criminal, security guard"
Baby Dolls Behind Bars,4.3,13,0,softcore
The Seasoning House,6.297,263,0,"revenge, land war, forced prostitution, rape and revenge, balkans"
We Are Legion: The Story of the Hacktivists,7.146,343,0,"hacker, cyber, hacking, anti-globalization, anti authority, activism"
A Mouse's Tale,5.8,17,0,trick film
Generation Um...,3.9,95,0,"new york city, relationship"
King of Comics,4.5,6,0,"aids, germany, male homosexuality, lgbt, gay theme, ralf könig"
Where the Dead Go to Die,5.615,65,0,"rape, nightmare, gun, hell, grave, gore, surrealism, tape, evil spirit, serial killer, demon, evil, adult animation, talking to animals, bestiality, nervous, amputee, child sexual abuse, talking animal, low budget, psychological manipulation, depressing"
The Lucky One,7.167,3769,99400000,"husband wife relationship, based on novel or book, iraq war veteran, photo, kennel, playing chess, bomb explosion"
The Real St. Nick,5.6,29,0,"holiday, mental institution, woman director, christmas"
This Is 40,5.892,2271,88200000,"husband wife relationship, family relationships, love, parenting, parents, financial problem, duringcreditsstinger, dubious"
TIGER & BUNNY: The Beginning,6.4,19,0,"superhero, superhero team, anime"
Michael Curtiz: The Greatest Director You Never Heard Of,6.667,3,0,movie business
Stories We Tell,7.1,225,0,"toronto, canada, family history, biography, montreal, canada, family secrets, family relationships, docudrama, woman director, father daughter relationship"
Conquest 1453,6.034,193,35000000,"arena, sultan, prophet, byzantium, conquest, ottoman empire, ottoman"
Heist: Who Stole the American Dream?,7.7,6,0,"capitalism, middle class, economics, financial crisis, corporation, poor"
A Few Hours of Spring,6.707,46,0,"suicide, mother, disease, family"
"3, 2, 1... Frankie Go Boom",5.765,100,0,"transsexual, jock strap, lgbt, sex tape"
Aladdin and the Death Lamp,4.227,22,0,"genie, magic lamp"
Paranormal Adoption,0.0,0,0,"funeral, adoption, murder, paranormal activity"
Louder Than Love: The Grande Ballroom Story,0.0,0,0,"rock music, detroit, michigan"
The Raven,6.304,1396,29657751,"poison, blackmail, masked ball, baltimore, usa, buried alive, historical figure, serial killer, deadline, newspaper review, newspaper office, hard times, life imitates art, pendulum"
Neighboring Sounds,7.1,231,47974,"pot smoking, neighbor, class differences, masturbation, racial tension, washing machine, real estate"
Cirque du Soleil: Worlds Away,7.0,171,34153101,"circus, clown, mimes, carnies, aerialist, acrobatics"
The Precocious and Brief Life of Sabina Rivas,7.103,117,2395000,"refugee camp, drug trafficking, singer, mexican, mexican army, sex slavery"
Emmanuelle Through Time: Rod Steele 0014 & Naked Agent 0069,3.7,5,0,softcore
Magic Mike,6.172,3035,167200000,"florida, seduction, based on true story, strip club, male stripper, novice, muscled, brother sister relationship, gay interest"
A Little Bit Zombie,5.1,69,0,zombie
Frankenstein: A Modern Myth,7.0,2,0,theatre
Nameless Gangster,6.872,180,0,"police, gangster, cop, decomposition, 1980s, bad guy, busan, south korea, south korea"
Night of the Living Dead: Re-Animation,6.2,111,0,prequel
The Dinosaur Project,5.8,315,2412576,"helicopter, africa, congo, jungle, dinosaur, scientist, discovery, found footage"
Gritty Melodrama: The Making of “Rust and Bone” by Jacques Audiard,10.0,1,0,"behind the scenes, making of, dvd extra"
The Queen of Versailles,6.901,213,714544,"affectation, wealth, bankruptcy, woman director, disturbed, desperate, absurd, dramatic, audacious, foreboding, melodramatic"
The Last Time I Saw Macao,6.6,16,0,macao
Zombie Ass: Toilet of the Dead,5.0,102,0,"fish, suicide, japan, cheating, shotgun, camping, egomania, karate, bullying, undead, toilet, woods, rape attempt, zombie, model, drugs, hatchet, feces, high school student, parasite, karma, tapeworms, japanese high school, high school girl, stolen vehicle"
Richard Strauss -  Ariadne Auf Naxos,0.0,0,0,opera
The Belgian Job,4.9,40,0,belgium
Un chapeau de paille d'Italie,7.1,4,0,vaudeville
Salmon Fishing in the Yemen,6.423,926,34564651,"husband wife relationship, bureaucracy, desert, salmon, arab, yemen, missing in action, flood, dreamer, public relations"
BBC Proms (2012): Gilbert & Sullivan - The Yeomen of the Guard,0.0,0,0,"opera, live"
The Hunt,8.1,4539,18300000,"pedophilia, denmark, parent child relationship, lie, father, kindergarten, teacher, tragedy, school, pedophile, bloody fight, divorce, hunting, pond, dead dog, grocery store, christmas, nude swimming, psychological drama, drama, apologetic, tragic"
Pretty Cure All Stars New Stage: Friends of the Future,6.0,9,0,"superhero, super power, superhero team, precure, supervillain, anime, superhero teamup, based on tv series, female superhero"
You've Been Trumped,6.464,42,0,"tycoon, scandal, political satire, environmental conservation, environmental destruction, ruthlessness, police harassment, sand dune, common good, contempt, citizen action, balmedie, scotland, david vs. goliath, community action"
Versailles '73: American Runway Revolution,0.0,0,0,woman director
Le Chef,6.2,619,306724,"cooking, chef, french cuisine"
Help for the Holidays,6.1,65,0,"sibling relationship, elves, santa claus, christmas tree, holiday season, christmas spirit, christmas"
Lawless,7.063,3210,55404207,"corruption, based on novel or book, prohibition era, brother, gangster, great depression, appalachia, bootlegging, shootout, brutality, church, moonshine, virginia, 1930s, lawman, brothers, violence"
Dirty Blondes from Beyond,4.3,11,0,"alien, alien contact, sex comedy, alien space craft"
Le fils de mon père,0.0,0,0,"1970s, based on true story, montreal, canada, bell, family drama, accidental death, family, mourning, money problems"
The Jungle,4.9,40,0,"husband wife relationship, marriage crisis, ocean, cave, architect, wilderness, tribe, vacation, dysfunctional marriage, human sacrifice, jungle, misunderstanding, tropical island, cannibalism"
Teacher Of The Year,0.0,0,0,"infidelity, teacher, school teacher"
The Vow,7.233,4168,196114570,"amnesia, coma, based on true story, romance, memory loss, car accident, valentine's day"
The Cat in the Hat Knows a Lot About Christmas!,5.6,5,0,christmas
The Silent Earth,7.0,1,0,"alone, loneliness"
SPEC: Heaven,7.2,25,0,"japan, detective, investigator, super power, public security, spec"
A Perfect Plan,5.877,647,0,"france, love"
Silver Linings Playbook,7.148,12378,236412453,"depression, infidelity, dancing, friendship, philadelphia, pennsylvania, based on novel or book, widow, superstition, letter, dance competition, teacher, mental institution, therapy, mental illness, ex-wife, institutionalization, death of husband, unfaithful wife, father son relationship"
Stories of the Paranormal: It Came in the Night,0.0,0,0,demon
Monicelli: La versione di Mario,5.5,3,0,woman director
That Guy... Who Was in That Thing,6.448,29,0,"acting, actor"
Ghosts of Ole Miss,7.0,8,0,"mississippi river, american football, college, civil rights, national guard, riot, american football team, sports documentary, college sports, college american football, university of mississippi, mississippi"
Baby's First Christmas,5.8,17,0,"co-workers relationship, christmas"
"Tad, the Lost Explorer",6.282,594,23000000,"treasure, helicopter, peru, pyramid, museum, parrot, hot air balloon, jungle, train, dog, desert, explorer, construction worker, romantic, amused, audacious"
Roman Polanski: Odd Man Out,6.0,6,0,woman director
Savages,6.346,2232,82966152,"explosive, widow, american abroad, eye gouging, dea agent, shot, southern california, surrogate daughter, laguna beach, california, enforcer, gardner, skull mask, dea, cruel"
V/H/S,6.095,1654,100345,"webcam, anthology, burglary, vhs, handheld camera, found footage, vcr, shocking, aggressive, frantic, analog, horror anthology, pov"
Exile: A Myth Unearthed,0.0,0,0,"palestinian-israeli conflict, zionism, diaspora, jewish history"
Les Enfoirés 2012 - Le Bal des Enfoirés,7.2,8,0,"concert, benefit concert, farewell concert, french music, tribute concert, music show, musical adaptation"
Argo,7.283,8690,232300000,"central intelligence agency (cia), husband wife relationship, revolution, press conference, biography, american abroad, extraction, iran hostage crisis, intelligence agent, langley virginia, 1980s, political thriller, factual"
Hitting the Cycle,0.0,0,0,"baseball, estranged father"
Puella Magi Madoka Magica the Movie Part I: Beginnings,7.5,132,5816330,"saving the world, parent child relationship, magic, wish, surrealism, female friendship, teenage girl, psychological thriller, schoolgirl, schoolmates, dark fantasy, anime"
About Cherry,4.6,309,8315,porn industry
Closer to God: Jessica's Journey,9.5,2,0,"cancer, tearjerker, terminal cancer, christian film"
Puella Magi Madoka Magica the Movie Part II: Eternal,7.5,113,5300000,"magic, surrealism, teenage girl, compilation, psychological thriller, schoolgirl, schoolmates, dark fantasy, aftercreditsstinger, edited from tv series, anime, magical girl"
Doubt on Loan,0.0,0,0,librarian
Rock of Ages,6.2,1313,59400000,"coming out, love triangle, rock star, musical, moral conflict, record producer, based on play or musical, alcoholism, rocker, hollywood, los angeles, california, rock musical, young love, music journalism, corrupt mayor, freelance journalist, 1980s, sunset strip, jukebox musical, church lady"
"Doin' It in the Park: Pick-Up Basketball, NYC",6.6,15,0,"new york city, playground, basketball, sports documentary, street ball"
London: The Modern Babylon,6.341,22,0,"london, england"
I Want You,7.455,1929,24016152,"friendship, based on novel or book, rebel, sequel, motor sport, street race, love, teenage love, young love, based on young adult novel"
Knight's Treasure,5.1,6,0,woman director
The House with 100 Eyes,3.5,13,0,"dark comedy, serial killer, torture chamber, torture, psycho killer, found footage, snuff film, horror"
Nantucket Film Festival's Comedy Roundtable,7.0,10,0,"round table, interview"
The Question,0.0,0,0,"woman director, short film"
Dark Tide,4.753,231,432274,"shark attack, shark, diver, diver instructor, cape town, south africa"
No Room for Rockstars,8.0,2,0,"music festival, concert film, live music, music documentary, band, tour"
Keep the Lights On,5.711,102,243959,"hiv, drug rehabilitation, intervention, lgbt, semi autobiographical, documentary filmmaking, substance abuse, sex worker, toxic relationship, gay theme"
Love 911,7.3,83,16786016,love story
Attenborough: 60 Years in the Wild,6.6,8,0,"biology, dna, biography, wildlife, nature, environmental conservation, environmental change "
Playing for Keeps,5.651,710,30962335,"mother, sports, parent child relationship, field, football (soccer), parent, penalty kick"
How to Get Out of the Cage (A year with John Cage),0.0,0,0,"composer, zen, stage performance"
Austin & Jessie & Ally All Star New Year,10.0,3,0,"new year's eve, new york city"
The Last Reef: Cities Beneath the Sea,7.4,20,0,"ocean, underwater, reef"
Death of a Shadow,6.7,43,0,"sacrifice, world war i, photographer, photography, reincarnation, steampunk, soldier, death, shadow, silhouette, short film, shooting"
La apuesta de Pascal,5.0,1,0,short film
S.A.L.P. Esercizio di memoria,0.0,0,0,factory
Chained,6.87,514,77839,"rap music, taxi driver, childhood trauma, incest overtones, serial killer, brainwashing, slave, chained, misogynist, isolated house, protégé, desolation, serial rapist, woman director, abuse"
The Woman in Black,6.141,3587,129000000,"london, england, remake, revenge, lawyer, dead child, photograph, gothic horror, period drama, super power, estate, ghost"
A Special Day,6.0,17,0,woman director
Head Over Heels 2,6.3,179,25402893,"sequel, romance"
"Park Avenue: Money, Power & The American Dream",7.0,27,0,"upper class, billionaire, economics, inequality, poor, wealth differences"
"I, Putin: A Portrait",4.8,11,0,vladimir putin
Underworld: Awakening,6.328,4236,160112671,"daughter, experiment, vampire, hybrid, child vampire, conspiracy, werewolf, fictional war, gothic, dark fantasy, werewolf child, urban gothic, good versus evil"
El Santos vs la Tetona Mendoza,6.602,49,946300,"adult animation, santos"
The Eric Andre New Year's Eve Spooktacular,7.857,7,0,talk show
Delhi Safari,5.1,19,3495597,musical
The Ballad of Genesis and Lady Jaye,6.9,17,0,"new york city, husband wife relationship, musician, photography, married couple, artists' life, performance art, writer, avant-garde, widower, synthesizer, music sampling, woman director, electronic music, cosmetic surgery, love story, artistsinlove, counterculture, experimental music, postmodern art"
Natalia Lafourcade - Mujer Divina (Homenaje A Agustín Lara),9.0,2,0,acoustic
Seeking a Friend for the End of the World,6.567,2189,9636289,"asteroid, road trip, end of the world, woman director, romantic"
Many Possible Futures. With Renato Nicolini,3.0,1,0,"rome, italy, highway"
Compliance,6.4,750,592116,"manager, fast food restaurant, based on true story, ohio, teenage girl, psychological thriller, police officer, police investigation, obedience, milgram experiment, obedience to authority"
The Raid,7.398,3708,9148519,"martial arts, s.w.a.t., crime boss, tenement, high rise, monitor, tower block, jakarta indonesia, aggressive, powerful"
Now Is Good,7.309,1097,2700000,"based on novel or book, cancer, teen drama, bucket list, based on young adult novel"
Santa's Summer House,3.846,14,0,"christmas, corgi"
"The Girl with the Dragon Tattoo: Characters - Salander, Blomkvist and Vanger",8.0,1,0,behind the scenes
Kimmy Dora and the Temple of Kiyeme,5.0,2,0,"marriage, philippines, ghost"
Return of the Killer Shrews,5.3,49,0,"sequel, camp, shrew, mutant animal, isolated island"
2016: Obama's America,4.0,54,33449086,"political documentary, independent film"
Meloetta's Moonlight Serenade,6.7,3,0,anime
Why They Sank Titanic,8.0,2,0,"truth, titanic, conspiracy theory, sinking ship"
Setsuna: Vampire's Love of 100 Days,6.5,2,0,"vampire human love, love & eros cinema collection"
Killjoy Goes to Hell,4.786,28,0,"trial, sequel, demon, evil clown, trial by combat"
The Man Who Loved Flowers,0.0,0,0,"based on short story, short film, adaptation, dollar baby"
A Liar's Autobiography: The Untrue Story of Monty Python's Graham Chapman,6.0,52,0,"fictional biography, gay theme"
Man in the Glass: The Dale Brown Story,2.0,1,0,"sports, louisiana, basketball, basketball coach, college basketball"
Hyde's Secret Nightmare,4.5,8,0,"obsession, perversion, phobia"
Bullet to the Head,5.625,1337,9489829,"corruption, bomb, detective, mercenary, louisiana, lawyer, shootout, ex-con"
The Day of the Siege: September Eleven 1683,4.3,51,0,"swordplay, siege, 17th century, ottoman empire"
The Curse of the Un-Kissable Kid,3.6,10,0,"fortune teller, gypsy, magic, carnival, kiss, bullying, bully, curse, principal, potion, teenage boy, lgbt, school principal, fortune-telling, gypsy woman, magic potion, gay theme"
The Iceman,6.557,1093,1969193,"van, new jersey, hitman, psychopath, restaurant, arrest, based on true story, jail, serial killer, drug dealing, stabbing, crime family, cynical, bombing, blunt, ice cream man  , psychotic, contract killer, crime syndicate, detached, aggressive, vexed, poisoning, cautionary, dramatic, antagonistic, callous, cruel"
All in Good Time,6.6,7,0,newlywed
The Words,6.7,1251,13231461,"plagiarized book, aspiring writer"
The Fitzgerald Family Christmas,5.979,24,0,"sibling relationship, holiday, irish-american, family gathering, christmas"
Bad Blood... the Hunger,8.333,3,0,"killing, beheading, suffocation, forbidden love, slaughter, human sacrifice, summer vacation, trapped, madness, road rage, flesh eating, ritual sacrifice, macabre, young love"
Night of the Living Dead: Resurrection,2.9,39,8393,"wales, countryside, zombie, struggle for survival, isolated farmhouse, lone survivor, terrified family, absurd"
Once Upon a Time in Phuket,5.3,35,36113796,"yoga, phuket, yoga instructor"
AniMen: The Galactic Battle,3.5,2,0,"future, space battle, alien, space, elite forces"
The Third Team: All-Access 2012 World Series,0.0,0,0,"sports, baseball, world series"
The World of Arata: World's/Start/Load/End,7.188,8,0,anime
Eurocrime! The Italian Cop and Gangster Films That Ruled the '70s,7.7,16,0,"cinema history, poliziottesco"
Tangled Ever After,7.1,1086,0,"princess, wedding ring, wedding, short film"
Rape Zombie: Lust of the Dead,6.5,241,0,"rape, zombie, softcore"
Blue Exorcist: The Movie,7.3,172,5994921,"supernatural, school, based on manga, demon, exorcist, shounen, anime"
A Letter to Momo,7.3,386,6748888,"parent child relationship, supernatural, family relationships, animism, supernatural creature, youkai, anime"
Doraemon: Nobita and the Island of Miracles – Animal Adventure,6.8,73,46180706,anime
Clip,5.3,123,0,"alcohol, despair, serbia, drug use, house party, drinking, cell phone, high school student, underage sex, woman director, sexual relationship, violent man, depravation, at risk youth"
Bronies: The Extremely Unexpected Adult Fans of My Little Pony,5.2,38,0,"friendship, pop culture, pony, fan culture, cosplay, fan convention, fandom"
Slice and Dice: The Slasher Film Forever,5.214,14,0,"gore, slasher"
The March Sisters at Christmas,5.1,27,0,"sibling relationship, christmas"
7 Days in Havana,5.7,110,197911,"anthology, short compilation"
The World is Ours,6.215,72,0,"spain, bank robbery, hostage situation, botched robbery, social issues, systemic corruption"
The Girl with the Dragon Tattoo: Hard Copy,7.0,1,0,behind the scenes
The South Seas 3D: Bikini Atoll & Marshall Islands,0.0,0,0,"fish, island, beach, south seas, pacific, palmen, tropical, diver, tropical island"
"Edward & George: Two Brothers, One Throne",0.0,0,0,edward viii
Love Is Not Perfect,5.4,38,0,love
Hush,4.563,8,0,"marriage proposal, prisoner, police, parent child relationship, killing, murder, sibling, anger, amusement park, finland, sexual behavior"
All About Christmas Eve,5.0,41,0,christmas
Finding Mrs. Claus,5.6,40,0,"holiday, christmas"
Stolen,5.491,1083,2106557,"kidnapping, taxi driver, fbi, thief, ex-con, young daughter, father daughter relationship, young girl daughter"
Nobody Walks,4.74,77,24995,"mumblecore, woman director"
Sofia the First: Once Upon a Princess,7.4,121,0,"princess, television pilot"
Beasts of the Southern Wild,6.834,1110,21107746,"explosive, refugee camp, hurricane, flooding, global warming, based on play or musical, bayou, crab, prehistoric creature, storm, celebration, magic realism, auroch, tough love, defrost, levee, lost mother, melting ice caps, shrimp, salt water, crawfish, shrimping, submerged, grits, african american child, wild man, candid, playful, whimsical, admiring, adoring, amused, appreciative, sympathetic, vibrant"
The Details,6.0,195,63595,"worm, raccoon"
I've Got to Kill Maria,5.5,2,0,short film
The Snowman and the Snowdog,6.9,81,0,"magic, santa claus, sequel, snowman, snow, dog, north pole, woman director, short film"
